ProjectID,RequirementText,IsFunctional,IsQuality,Availability (A),Fault Tolerance (FT),Legal (L),Look & Feel (LF),Maintainability (MN),Operability (O),Performance (PE),Portability (PO),Scalability (SC),Security (SE),Usability (US),Other (OT),CleanedRequirementText,IsOutlierRule,OutlierProbability,IsOutlierModel,IsOutlierFinal
13,The WCS system shall not allow automatic logins by any user. Cookies containing WCS login information about a user will not be stored on a user's computer.',0,1,0,0,0,0,0,0,0,0,0,1,0,0,wcs system shall allow automatic logins user cooky containing wcs login information user stored user computer,0,0.00494161254088592,0,0
14,Each team owner will need to use a username and password in order to be authenticated to reach the team owner's page',0,1,0,0,0,0,0,0,0,0,0,1,0,0,team owner need use username password order authenticated reach team owner page,0,0.3993515857374242,0,0
14,'The Commissioner will be the only authorized user per league to adjust league settings.',0,1,0,0,1,0,0,0,0,0,0,1,0,0,commissioner authorized user per league adjust league setting,0,0.20859303756577247,0,0
14,'Each page shall contain a navigation menu which shows the index into which the current page is contained.',0,1,0,0,0,1,0,0,0,0,0,0,0,0,page shall contain navigation menu show index current page contained,0,0.06853152832599113,0,0
14,'Each page shall contain a similar format with action items in one location and navigation buttons in a different location.',0,1,0,0,0,1,0,0,0,0,0,0,1,0,page shall contain similar format action item one location navigation button different location,0,0.2285636916190667,0,0
14,'The message board shall contain the 5 most recently posted messages on the league page. The messages will contain up to the first 150 characters of the message.',1,0,0,0,0,0,0,0,0,0,0,0,0,0,message board shall contain NUM recently posted message league page message contain first NUM character message,0,0.09461135069059204,0,0
14,'A new user shall be able to navigate through the league and team pages within 30 seconds of reaching the start-up page.',0,1,0,0,0,1,0,0,1,0,0,0,1,0,new user shall able navigate league team page within NUM second reaching startup page,0,0.00468092841017294,0,0
14,"Users shall be able to reach the 'add' , drop',  and 'trade player' pages with one click from the team owner's page.'",0,1,0,0,0,1,0,0,0,0,0,0,1,0,user shall able reach add drop trade player page one click team owner page,0,0.033596619337936784,0,0
14,'Users shall be able to view at least 25 NFL player statistics and points on each page.',1,1,0,0,0,0,0,0,1,0,0,0,0,0,user shall able view least NUM nfl player statistic point page,0,0.00821261227389031,0,0
14,'The application shall ask the user to confirm dropping a player or trading a player before performing the action.',1,0,0,0,0,0,0,0,0,0,0,0,0,0,application shall ask user confirm dropping player trading player performing action,0,0.035957482375724166,0,0
14,'The application shall be able to complete every user transaction within one fourth of a second of receiving the request over the network.',0,1,1,0,0,0,0,0,1,0,0,0,0,0,application shall able complete every user transaction within one fourth second receiving request network,0,0.008104349707671816,0,0
14,'The application shall have a downtime of at most 10 minutes per year.',0,1,1,0,0,0,0,0,0,0,0,0,0,0,application shall downtime NUM minute per year,0,0.03322954037576091,0,0
14,'The application shall run on a web application server.',0,1,0,0,0,0,0,1,0,0,0,0,0,0,application shall run web application server,0,0.03226950449044461,0,0
14,'A primary database will be used to store cached data for active users.',0,1,0,0,0,0,1,1,0,0,0,0,0,0,primary database used store cached data active user,0,0.28811054875423964,0,0
14,'A secondary database will be used to store historical statistics and data.',0,1,0,0,0,0,1,1,0,0,0,0,0,0,secondary database used store historical statistic data,0,0.19696096533660915,0,0
14,'Application updates shall occur between 3AM and 6 AM CST on Wednesday morning during the middle of the NFL season.',0,1,0,0,0,0,1,0,0,0,0,0,0,0,application update shall occur NUM am NUM cst wednesday morning middle nfl season,0,0.08676936561425956,0,0
14,'New System version releases shall be released at the beginning of each NFL season.',0,1,0,0,0,0,1,0,0,0,0,0,0,0,new system version release shall released beginning nfl season,0,0.05223872667959375,0,0
15,'The RFS system should be available 24/7 especially during the budgeting period. The RFS system shall be available 90% of the time all year and 98% during the budgeting period. 2% of the time the system will become available within 1 hour of the time that the situation is reported.',0,1,1,1,0,0,0,0,1,0,0,0,0,0,rf system available NUM especially budgeting period rf system shall available NUM time year NUM budgeting period NUM time system become available within NUM hour time situation reported,0,0.011016217535950607,0,0
15,'98% of the user workstations shall meet the minimum hardware requirements prior to implementation. Minimum Hard Disk Space: 400MB.',0,1,0,0,0,0,0,1,0,0,0,0,0,0,NUM user workstation shall meet minimum hardware requirement prior implementation minimum hard disk space NUM mb,0,0.07234062917245651,0,0
15,'98% of the user workstations shall meet the minimum software requirements prior to implementation: Microsoft Internet Explorer 5.0. Microsoft .NET Framework 1.1. Microsoft Internet Explorer Web Controls',0,1,0,0,0,0,0,1,0,0,0,0,0,0,NUM user workstation shall meet minimum software requirement prior implementation microsoft internet explorer NUM microsoft net framework NUM microsoft internet explorer web control,0,0.3565837793035421,0,0
15,The RFS system should be able to easily interface with the BDW environment in order to load the data. Seven data files shall be received from the BDW and loaded into the RFS system within 3 hours one day prior to the start of budgeting process every year. The data will be as of October month-end. Test files (7) shall be loaded up to 5 times throughout the year from the BDW.',0,1,0,0,0,0,0,1,1,0,0,0,0,0,rf system able easily interface bdw environment order load data seven data file shall received bdw loaded rf system within NUM hour one day prior start budgeting process every year data october monthend test file NUM shall loaded NUM time throughout year bdw,0,0.010886389584145846,0,0
15,'Changes to revenue and expense formulae must be applied to the RFS system every year prior to the budgeting process start. Revenue and expense formulae will be updated within one week of their receipt after which 2 weeks will be allotted to testing of the budget calculations to be conducted jointly by the project development team and PCG Finance.',0,1,0,0,1,0,1,0,0,0,0,0,0,0,change revenue expense formula must applied rf system every year prior budgeting process start revenue expense formula updated within one week receipt NUM week allotted testing budget calculation conducted jointly project development team pcg finance,0,0.1589589191357566,0,0
15,'New branches/complexes/districts/regions and revenue/expense accounts added to the BDW must be reflected in the RFS system. 100% of the entities (mentioned above) available as of October month-end will be loaded into the RFS system prior to the budget start process.',0,1,1,0,0,0,1,0,0,0,0,0,0,0,new branchescomplexesdistrictsregions revenueexpense account added bdw must reflected rf system NUM entity mentioned available october monthend loaded rf system prior budget start process,0,0.0841232035068479,0,0
15,'Only authorized user shall access the RFS system. ONLY users that exist in the UAS system with the RFS system assigned to their role(s) shall access the RFS system and use it.',0,1,0,0,0,0,0,0,0,0,0,1,0,0,authorized user shall access rf system user exist uas system rf system assigned role shall access rf system use,0,0.0004234117675690293,0,0
15,User access should be limited to the permissions granted to their role(s) Each level in the PCG hierarchy will be assigned a role and users will be assigned to these roles. Access to functionality within RFS system is dependent on the privileges/permission assigned to the role.',0,1,0,0,0,0,0,0,0,0,0,1,0,0,user access limited permission granted role level pcg hierarchy assigned role user assigned role access functionality within rf system dependent privilegespermission assigned role,0,0.21445463580983198,0,0
15,'The product must comply with the intranet page standards and requirements of ENET Securities. 95% of the product look & feel will be approved by the Architecture group prior to implementation. The remaining 5% will be corrected and approved within one month of product release.',0,1,0,0,1,1,0,0,0,0,0,0,0,0,product must comply intranet page standard requirement enet security NUM product look feel approved architecture group prior implementation remaining NUM corrected approved within one month product release,0,0.019667640707310318,0,0
15,'The users should be able to easily use the system to successfully complete their budgets within the stipulated time for completion. With a week of training prior to product implementation 98% of the users shall complete their budgets within the stipulated time.',0,1,0,0,0,0,0,0,0,0,0,0,1,0,user able easily use system successfully complete budget within stipulated time completion week training prior product implementation NUM user shall complete budget within stipulated time,0,0.016913457517525463,0,0
15,'The product interface should be fast. The response time of the product interface should not exceed 2 seconds 90% of the time. For 10% of the time the response time should not be more than 10 seconds.not be more than 10 seconds.',0,1,1,0,0,0,0,0,1,0,0,0,0,0,product interface fast response time product interface exceed NUM second NUM time NUM time response time NUM secondsnot NUM second,0,0.19166474755145482,0,0
SYN-100,The carpooling platform shall maintain a minimum uptime of 99.9% measured on a rolling 30-day window excluding scheduled maintenance windows communicated at least 48 hours in advance.,0,1,1,0,0,0,0,0,0,0,0,0,0,0,carpooling platform shall maintain minimum uptime NUM measured rolling NUM day window excluding scheduled maintenance window communicated least NUM hour advance,0,0.022580238592016647,0,0
SYN-101,All authentication tokens issued by the restaurant delivery API shall be signed using AES-256 encryption and validated on every request through an OAuth 2.0 bearer token flow.,0,1,0,0,0,0,0,0,0,0,0,1,0,0,authentication token issued restaurant delivery api shall signed using aes NUM encryption validated every request oauth NUM bearer token flow,0,0.04790355692104568,0,0
SYN-102,The automated data pipeline shall comply with GDPR Article 17 right-to-erasure obligations by purging all personal data within 72 hours of a verified deletion request.,0,1,0,0,1,0,0,0,0,0,0,0,0,0,automated data pipeline shall comply gdpr article NUM righttoerasure obligation purging personal data within NUM hour verified deletion request,0,0.018077986243340165,0,0
SYN-103,The mobile driver application for the carpooling service shall render consistently on screens ranging from 4.7 inches to 12.9 inches and support both portrait and landscape orientations without layout breakage.,0,1,0,0,0,1,0,0,0,0,0,0,0,0,mobile driver application carpooling service shall render consistently screen ranging NUM inch NUM inch support portrait landscape orientation without layout breakage,0,0.026527247801279286,0,0
SYN-104,The restaurant delivery platform shall process a customer checkout request and return an order confirmation within 1.2 seconds at the 95th percentile under a load of 500 concurrent users.,0,1,0,0,0,0,0,0,1,0,0,0,0,0,restaurant delivery platform shall process customer checkout request return order confirmation within NUM second NUM th percentile load NUM concurrent user,0,0.005416274787300485,0,0
SYN-105,"The backend data pipeline shall be deployable as a Dockerized container image and shall run without modification on AWS ECS, Google Cloud Run, and Azure Container Instances.",0,1,0,0,0,0,0,0,0,1,0,0,0,0,backend data pipeline shall deployable dockerized container image shall run without modification aws ec google cloud run azure container instance,0,0.012630083346508461,0,0
SYN-106,The carpooling platform shall support horizontal scaling to accommodate a 10x surge in ride-matching requests during peak commuting hours without degradation of response times.,0,1,0,0,0,0,0,0,0,0,1,0,0,0,carpooling platform shall support horizontal scaling accommodate NUM x surge ridematching request peak commuting hour without degradation response time,0,0.014108133255917333,0,0
SYN-107,The system shall implement role-based access control (RBAC) so that restaurant managers can only view reports scoped to their own outlets and cannot access data belonging to other tenants.,0,1,0,0,0,0,0,0,0,0,0,1,0,0,system shall implement rolebased access control rbac restaurant manager view report scoped outlet access data belonging tenant,0,0.008860782830584836,0,0
SYN-108,The customer-facing ordering web application shall achieve a Web Content Accessibility Guidelines (WCAG) 2.1 Level AA conformance rating so that users with visual impairments can complete an order without assistance.,0,1,0,0,0,0,0,0,0,0,0,0,1,0,customerfacing ordering web application shall achieve web content accessibility guideline wcag NUM level aa conformance rating user visual impairment complete order without assistance,0,0.09783049734748105,0,0
SYN-109,The data pipeline orchestration service shall record structured audit logs for every DAG run including start time end time exit code and operator-level error messages to facilitate post-incident analysis.,0,1,0,0,0,0,0,0,0,0,0,0,0,1,data pipeline orchestration service shall record structured audit log every dag run including start time end time exit code operatorlevel error message facilitate postincident analysis,0,0.06128320643425355,0,0
SYN-110,The carpooling service shall remain available for ride booking and tracking operations during partial backend failures by serving cached route data and queuing booking requests locally for up to 5 minutes.,0,1,0,1,0,0,0,0,0,0,0,0,0,0,carpooling service shall remain available ride booking tracking operation partial backend failure serving cached route data queuing booking request locally NUM minute,0,0.03528764841566775,0,0
SYN-111,The restaurant delivery platform shall be available to end customers 24 hours a day 7 days a week including public holidays with a maximum tolerated unplanned downtime of 4 hours per calendar month.,0,1,1,0,0,0,0,0,0,0,0,0,0,0,restaurant delivery platform shall available end customer NUM hour day NUM day week including public holiday maximum tolerated unplanned downtime NUM hour per calendar month,0,0.012745085583722367,0,0
SYN-112,The data pipeline shall comply with Pakistan's Personal Data Protection Bill requirements by ensuring all personally identifiable information is stored within data centers physically located within national borders to satisfy data sovereignty obligations.,0,1,0,0,1,0,0,0,0,0,0,0,0,0,data pipeline shall comply pakistan personal data protection bill requirement ensuring personally identifiable information stored within data center physically located within national border satisfy data sovereignty obligation,0,0.022237999279407623,0,0
SYN-113,The iOS and Android driver applications shall share a single React Native codebase and be deployable to both platforms from a single CI/CD pipeline without platform-specific branching in the business logic layer.,0,1,0,0,0,0,0,0,0,1,0,0,0,0,io android driver application shall share single react native codebase deployable platform single cicd pipeline without platformspecific branching business logic layer,0,0.10197879823275703,0,0
SYN-114,The onboarding flow for new restaurant partners shall be completable within 10 minutes by a user with no prior training with no step requiring more than 3 user interactions to advance.,0,1,0,0,0,0,0,0,0,0,0,0,1,0,onboarding flow new restaurant partner shall completable within NUM minute user prior training step requiring NUM user interaction advance,0,0.04241503339079867,0,0
SYN-115,The carpooling platform's source code shall adhere to modular monorepo conventions using clearly defined package boundaries so that a developer unfamiliar with the codebase can locate and patch a fare-calculation bug within 2 hours.,0,1,0,0,0,0,1,0,0,0,0,0,0,0,carpooling platform source code shall adhere modular monorepo convention using clearly defined package boundary developer unfamiliar codebase locate patch farecalculation bug within NUM hour,0,0.036762332322050326,0,0
SYN-116,The automated data pipeline shall degrade gracefully when an upstream data source becomes unreachable by skipping the affected partition logging a structured warning and continuing to process all remaining partitions without operator intervention.,0,1,0,1,0,0,0,0,0,0,0,0,0,0,automated data pipeline shall degrade gracefully upstream data source becomes unreachable skipping affected partition logging structured warning continuing process remaining partition without operator intervention,0,0.033149139472950194,0,0
SYN-117,The web-based restaurant delivery dashboard shall match the brand color palette defined in the corporate design system using hex codes #E63946 for primary actions and #F1FAEE for background surfaces.,0,1,0,0,0,1,0,0,0,0,0,0,0,0,webbased restaurant delivery dashboard shall match brand color palette defined corporate design system using hex code e NUM primary action f NUM faee background surface,0,0.018228066616800258,0,0
SYN-118,The carpooling platform shall execute a ride-match algorithm and return a ranked list of available drivers to the requesting passenger within 800 milliseconds end-to-end at median load.,0,1,0,0,0,0,0,0,1,0,0,0,0,0,carpooling platform shall execute ridematch algorithm return ranked list available driver requesting passenger within NUM millisecond endtoend median load,0,0.012506246864405886,0,0
SYN-119,The restaurant delivery application server shall be hardware-agnostic and shall operate correctly on ARM64 and x86-64 processor architectures without recompilation or configuration changes.,0,1,0,0,0,0,0,0,0,1,0,0,0,0,restaurant delivery application server shall hardwareagnostic shall operate correctly arm NUM x NUM processor architecture without recompilation configuration change,0,0.0017736840544653036,0,0
SYN-120,The carpooling platform database cluster shall scale write throughput automatically from 500 to 50000 transactions per second by adding read replicas and sharding the rides table by geographic region without manual DBA intervention.,0,1,0,0,0,0,0,0,0,0,1,0,0,0,carpooling platform database cluster shall scale write throughput automatically NUM NUM transaction per second adding read replica sharding ride table geographic region without manual dba intervention,0,0.011131867629591825,0,0
SYN-121,All payment card data transmitted through the restaurant delivery checkout flow shall be protected using TLS 1.3 and the platform shall undergo a third-party penetration test at least once per calendar year with all critical findings remediated within 30 days.,0,1,0,0,0,0,0,0,0,0,0,1,0,0,payment card data transmitted restaurant delivery checkout flow shall protected using tl NUM platform shall undergo thirdparty penetration test least per calendar year critical finding remediated within NUM day,0,0.004877484284863759,0,0
SYN-122,The data pipeline platform shall maintain SLA availability of 99.5% for all scheduled pipeline executions measured monthly with automated alerting triggered when cumulative downtime exceeds 3 hours in any rolling 30-day period.,0,1,1,0,0,0,0,0,0,0,0,0,0,0,data pipeline platform shall maintain sla availability NUM scheduled pipeline execution measured monthly automated alerting triggered cumulative downtime exceeds NUM hour rolling NUM day period,0,0.03459393051593194,0,0
SYN-123,The restaurant delivery platform shall comply with applicable consumer protection regulations in each operating jurisdiction and shall present legally required allergen disclosures prominently on every menu item detail page prior to any purchase action.,0,1,0,0,1,0,0,0,0,0,0,0,0,0,restaurant delivery platform shall comply applicable consumer protection regulation operating jurisdiction shall present legally required allergen disclosure prominently every menu item detail page prior purchase action,0,0.005022819224317826,0,0
SYN-124,The carpooling application shall display a consistent visual hierarchy across all screens using the Inter typeface at designated size scales and a maximum of 3 accent colors to ensure a professional and coherent look and feel.,0,1,0,0,0,1,0,0,0,0,0,0,0,0,carpooling application shall display consistent visual hierarchy across screen using inter typeface designated size scale maximum NUM accent color ensure professional coherent look feel,0,0.03447104111498797,0,0
SYN-125,The data pipeline framework shall be instrumented so that a data engineer can add a new transformation step by creating a single Python module conforming to the operator interface without modifying any existing pipeline definition files.,0,1,0,0,0,0,1,0,0,0,0,0,0,0,data pipeline framework shall instrumented data engineer add new transformation step creating single python module conforming operator interface without modifying existing pipeline definition file,0,0.04633564009828186,0,0
SYN-126,The automated ETL pipeline shall operate within the resource limits of a standard 4-vCPU 16 GB RAM Kubernetes pod and shall not require elevated cluster-admin privileges to run scheduled jobs.,0,1,0,0,0,0,0,1,0,0,0,0,0,0,automated etl pipeline shall operate within resource limit standard NUM vcpu NUM gb ram kubernetes pod shall require elevated clusteradmin privilege run scheduled job,0,0.008876993919602923,0,0
SYN-127,The carpooling platform shall return live vehicle location updates to the passenger application at a refresh interval not exceeding 3 seconds under normal network conditions and no greater than 10 seconds under degraded 3G connectivity.,0,1,0,0,0,0,0,0,1,0,0,0,0,0,carpooling platform shall return live vehicle location update passenger application refresh interval exceeding NUM second normal network condition greater NUM second degraded NUM g connectivity,0,0.05987497553036244,0,0
SYN-128,The restaurant delivery web application shall be deployable as a cross-platform Progressive Web App installable on Windows macOS Linux iOS and Android without publishing separate native binaries to platform-specific app stores.,0,1,0,0,0,0,0,0,0,1,0,0,0,0,restaurant delivery web application shall deployable crossplatform progressive web app installable window macos linux io android without publishing separate native binary platformspecific app store,0,0.023809748851990636,0,0
SYN-129,The carpooling platform's microservices architecture shall allow the ride-matching service to be scaled independently to 200 instances during sporting events or public holidays without requiring redeployment of the payment or notification services.,0,1,0,0,0,0,0,0,0,0,1,0,0,0,carpooling platform microservices architecture shall allow ridematching service scaled independently NUM instance sporting event public holiday without requiring redeployment payment notification service,0,0.01409394284228646,0,0
SYN-130,The carpooling application shall enforce multi-factor authentication for all driver accounts and shall store credential hashes using bcrypt with a minimum cost factor of 12 with no plaintext or reversibly encrypted passwords permitted in the database.,0,1,0,0,0,0,0,0,0,0,0,1,0,0,carpooling application shall enforce multifactor authentication driver account shall store credential hash using bcrypt minimum cost factor NUM plaintext reversibly encrypted password permitted database,0,0.014426892948446882,0,0
SYN-131,New users of the restaurant delivery application shall be able to browse menus add items to a cart and place a first order within 4 minutes of opening the application for the first time with no prior product training.,0,1,0,0,0,0,0,0,0,0,0,0,1,0,new user restaurant delivery application shall able browse menu add item cart place first order within NUM minute opening application first time prior product training,0,0.013969217422610246,0,0
SYN-132,The automated data pipeline shall emit OpenTelemetry-compliant trace spans for every task execution enabling full distributed tracing from ingestion source to data warehouse sink without requiring custom instrumentation in individual operator code.,0,1,0,0,0,0,0,0,0,0,0,0,0,1,automated data pipeline shall emit opentelemetrycompliant trace span every task execution enabling full distributed tracing ingestion source data warehouse sink without requiring custom instrumentation individual operator code,0,0.05770994063509081,0,0
SYN-133,In the event of a primary database node failure the carpooling platform shall automatically promote a hot standby replica and resume accepting ride bookings within 30 seconds using a pre-configured failover policy with no manual operator intervention required.,0,1,0,1,0,0,0,0,0,0,0,0,0,0,event primary database node failure carpooling platform shall automatically promote hot standby replica resume accepting ride booking within NUM second using preconfigured failover policy manual operator intervention required,0,0.033584619101292526,0,0
