ProjectID,RequirementText,IsFunctional,IsQuality,Availability (A),Fault Tolerance (FT),Legal (L),Look & Feel (LF),Maintainability (MN),Operability (O),Performance (PE),Portability (PO),Scalability (SC),Security (SE),Usability (US),Other (OT),CleanedRequirementText,IsOutlierRule,OutlierProbability,IsOutlierModel,IsOutlierFinal
6,'The product shall allow the user to select a chosen language from one of the target market countries.',1,1,0,0,0,0,0,0,0,0,0,0,1,0,product shall allow user select chosen language one target market country,0,0.004669537922737001,0,0
6,'The product shall allow for customization of start page and views preferences.',0,1,0,0,0,0,0,0,0,0,0,0,1,0,product shall allow customization start page view preference,0,0.00039269127339007384,0,0
6,'An employee will be able to successfully use the product within a few minutes. After informally navigating the product for less than 15 minutes users shall be able to successfully setup meetings and reserve conference rooms.',0,1,0,0,0,0,0,0,0,0,0,0,1,0,employee able successfully use product within minute informally navigating product less NUM minute user shall able successfully setup meeting reserve conference room,0,0.009164730066559408,0,0
6,'The product shall use a standard navigation menu familiar to most web users.',0,1,0,0,0,0,0,0,0,0,0,0,1,0,product shall use standard navigation menu familiar web user,0,0.0026199145901575818,0,0
6,'The product shall allow for intuitive searching of available conference rooms.',1,1,0,0,0,0,0,0,0,0,0,0,1,0,product shall allow intuitive searching available conference room,0,0.0019318454892526171,0,0
6,'The product shall conform to the Americans with Disabilities Act.',0,1,0,0,1,0,0,0,0,0,0,0,0,0,product shall conform american disability act,0,0.0010414309343546218,0,0
6,The response shall be fast enough to avoid interrupting the user's flow of thought. 90% of tasks shall complete within 5 seconds. 98% of tasks shall complete within 8 seconds.',0,1,0,0,0,0,0,0,1,0,0,0,0,0,response shall fast enough avoid interrupting user flow thought NUM task shall complete within NUM second NUM task shall complete within NUM second,0,0.0026512119396177227,0,0
6,'Aside from server failure the software product shall achieve 99.99% up time.',0,1,1,0,0,0,0,0,0,0,0,0,0,0,aside server failure software product shall achieve NUM time,0,0.009629669132191846,0,0
6,'The product shall create an exception log of problems encountered within the product for transmission to our company for analysis and resolution.',1,1,0,0,0,0,1,0,0,0,0,0,0,0,product shall create exception log problem encountered within product transmission company analysis resolution,0,0.00545194307391273,0,0
6,'The product shall be capable of handling up to 1 000 concurrent requests. This number will increase to 2 000 by Release 2. The concurrency capacity must be able to handle peak scheduling times such as early morning and late afternoon hours.',0,1,0,0,0,0,0,0,0,0,1,0,0,0,product shall capable handling NUM NUM concurrent request number increase NUM NUM release NUM concurrency capacity must able handle peak scheduling time early morning late afternoon hour,0,0.013176339654796325,0,0
6,'The product shall be able to process 10 000 transactions per hour within two years of its launch. This number will increase to 20 000 by Release 2.',0,1,0,0,0,0,0,0,0,0,1,0,0,0,product shall able process NUM NUM transaction per hour within two year launch number increase NUM NUM release NUM,0,0.002541503520814292,0,0
6,'The product shall be expected to operate for at least 5 years for each customer installation.',0,1,0,0,0,0,0,1,0,0,0,0,0,0,product shall expected operate least NUM year customer installation,0,0.0028081456921963325,0,0
6,'The product shall be used in office environments.',0,1,0,0,0,0,0,1,0,0,0,0,0,0,product shall used office environment,0,0.0022239939520216864,0,0
6,'The product must be able to interface with any HTML browser. The product shall transmit data between the user and the product without problems. The product shall display HTML properly in 80% of all HTML browsers tested (minimum is to test 8 browsers).',0,1,0,0,0,1,0,1,0,1,0,0,0,0,product must able interface html browser product shall transmit data user product without problem product shall display html properly NUM html browser tested minimum test NUM browser,0,0.00017540551631854101,0,0
6,'The product must be able to interface with various database management systems. The product shall communicate successfully with the database management system on 100% of all transactions.',0,1,1,0,0,0,0,1,0,1,0,0,0,0,product must able interface various database management system product shall communicate successfully database management system NUM transaction,0,0.0005368666486084868,0,0
6,'The product must be able to interface with various email servers. The product shall be able to send email.',0,1,0,0,0,0,0,1,0,1,0,0,0,0,product must able interface various email server product shall able send email,0,0.0005783899885046552,0,0
6,'The product shall be available for distribution via the Internet as a binary or ZIP file.',0,1,0,0,0,0,0,1,0,0,0,0,0,0,product shall available distribution via internet binary zip file,0,0.01116849488089081,0,0
6,'The product shall be available for distribution as a packaged CD.',0,1,0,0,0,0,0,1,0,0,0,0,0,0,product shall available distribution packaged cd,0,0.0040925796624771815,0,0
6,'The product will be available for licensing as a one-server two-five servers or five-or-more servers license.',0,1,0,0,0,0,0,1,0,0,0,0,0,0,product available licensing oneserver twofive server fiveormore server license,0,0.33595605361184677,0,0
6,'A new user must be able to be added to the system within 10 minutes. 90% of new users are able to log into the system within 10 minutes.',0,1,0,0,0,0,0,0,1,0,0,0,0,0,new user must able added system within NUM minute NUM new user able log system within NUM minute,0,0.007978164156419056,0,0
6,'The product must be designed using Design Patterns and coding best practices. 90% of maintenance software developers are able to integrate new functionality into the product with 2 working days.',0,1,0,0,0,0,1,0,0,0,0,0,0,0,product must designed using design pattern coding best practice NUM maintenance software developer able integrate new functionality product NUM working day,0,0.017026636190223283,0,0
6,The product must be highly configurable for use with various database management systems for the end users. 80% of end users are able to integrate new database management systems with the product without changing the product's software code.',0,1,0,0,0,0,1,0,0,1,0,0,0,0,product must highly configurable use various database management system end user NUM end user able integrate new database management system product without changing product software code,0,0.011331789684753544,0,0
6,'Maintenance releases will be offered to customers once a year. The releases shall take no longer than 5 minutes for 80% of the customer base to install.',0,1,0,0,0,0,1,0,1,0,0,0,0,0,maintenance release offered customer year release shall take longer NUM minute NUM customer base install,0,0.06955018171177944,0,0
6,Every registered user will have access to the product's support site via the Internet. 70% of registered users shall find a solution to their problem within 5 minutes of using the support site.',0,1,0,0,0,1,0,0,0,0,0,1,1,0,every registered user access product support site via internet NUM registered user shall find solution problem within NUM minute using support site,0,0.0066916402400323104,0,0
6,The customer shall be able to easily integrate new building maps with the product throughout the product's lifecycle. Integration of new maps with the product shall be possible with little to no support from product support staff.',0,1,0,0,0,0,1,0,0,0,0,0,0,0,customer shall able easily integrate new building map product throughout product lifecycle integration new map product shall possible little support product support staff,0,0.0006790881401764976,0,0
6,The product shall be translated into foreign languages other than the target market countries' languages in future releases. For each emerging target market it shall take no more than 5 days to configure the product for that market's language.',0,1,0,0,0,0,1,0,0,0,1,0,1,0,product shall translated foreign language target market country language future release emerging target market shall take NUM day configure product market language,0,0.01792793838042327,0,0
6,'The product is expected to integrate with multiple database management systems. The product will operate with Oracle SQL Server DB2 MySQL HSQL and MS Access.',0,1,0,0,0,0,0,1,0,1,0,0,0,0,product expected integrate multiple database management system product operate oracle sql server db NUM mysql hsql m access,0,0.048169337295842295,0,0
6,'The product shall be able to be installed in any operating environment within 2 days.',0,1,0,0,0,0,0,1,0,1,0,0,0,0,product shall able installed operating environment within NUM day,0,0.003195927217013783,0,0
6,'The product shall ensure that only company employees or external users with company-approved user IDs may have product access. 100% of all logons shall be by either company employees or external users with company-approved user IDs.',0,1,0,0,0,0,0,0,0,0,0,1,0,0,product shall ensure company employee external user companyapproved user id may product access NUM logons shall either company employee external user companyapproved user id,0,0.005731502099574348,0,0
6,'Only managers are able to perform search queries for reservations by user. 100% of all search queries for reservations by user shall be from logons of only management logons.',1,1,0,0,0,0,0,0,0,0,0,1,0,0,manager able perform search query reservation user NUM search query reservation user shall logons management logons,0,0.03507796736014891,0,0
6,The product shall ensure that the database's data corresponds to the data entered by the user. Each conference room reservation in the system will contain the same information as was entered by the user.',0,1,0,0,0,0,0,0,0,0,0,1,0,0,product shall ensure database data corresponds data entered user conference room reservation system contain information entered user,0,0.00027420767526161355,0,0
6,The product shall prevent the input of malicious data. The product and/or adjacent hardware/software systems' data shall remain 100% uncorrupted each time malicious data is input into the product.',0,1,0,0,0,0,0,0,0,0,0,1,0,0,product shall prevent input malicious data product andor adjacent hardwaresoftware system data shall remain NUM uncorrupted time malicious data input product,0,0.0016551833254245044,0,0
6,'The product and/or dependent databases/filesystems shall remain operational as a result of the input of malicious data. The product and/or dependent databases/filesystems shall not crash 100% of the time that malicious data is input into the product.',0,1,1,1,0,0,0,0,0,0,0,1,0,0,product andor dependent databasesfilesystems shall remain operational result input malicious data product andor dependent databasesfilesystems shall crash NUM time malicious data input product,0,0.004033281449836154,0,0
6,'The product shall have the ability to receive automatic software updates as new threats emerge. 100% of customers will be able to receive automatic software updates transmitted to the installed product.',0,1,0,0,0,0,1,0,0,0,0,1,0,0,product shall ability receive automatic software update new threat emerge NUM customer able receive automatic software update transmitted installed product,0,0.06101904712001584,0,0
6,'The language of the product shall accommodate all of the target market countries. 90% of survey respondents from each target market country will find that the language of the product is acceptable.',0,1,0,0,0,0,0,0,0,0,1,0,1,0,language product shall accommodate target market country NUM survey respondent target market country find language product acceptable,0,0.07249376975522656,0,0
6,The product shall be able to display calendar dates and times according to the user's locale. 90% of survey respondents from each target market country will find that the date and time formatting of the product is correct.',1,1,0,0,0,0,0,0,0,0,0,0,1,0,product shall able display calendar date time according user locale NUM survey respondent target market country find date time formatting product correct,0,0.003261265064840167,0,0
6,'The product must be developed with the J2SE/J2EE programming language libraries',0,1,0,0,0,0,0,1,0,0,0,0,0,0,product must developed j NUM sej NUM ee programming language library,0,0.023714388148001753,0,0
6,'The product shall record meeting entries.',1,0,0,0,0,0,0,0,0,0,0,0,0,0,product shall record meeting entry,0,0.0008712472993222691,0,0
6,'The product will notify employees of meeting invitations.',1,0,0,0,0,0,0,0,0,0,0,0,0,0,product notify employee meeting invitation,0,0.10602506231989978,0,0
6,'The product shall have the ability to send meeting reminders to employees.',1,0,0,0,0,0,0,0,0,0,0,0,0,0,product shall ability send meeting reminder employee,0,0.00120320597387936,0,0
6,'The product shall assign the organizers contact information to each meeting they create.',1,0,0,0,0,0,0,0,0,0,0,0,0,0,product shall assign organizer contact information meeting create,0,0.005003035896036957,0,0
6,'The product will record meeting acknowledgements.',1,0,0,0,0,0,0,0,0,0,0,0,0,0,product record meeting acknowledgement,0,0.10778268872718173,0,0
6,'The product shall store new conference rooms.',1,0,0,0,0,0,0,0,0,0,0,0,0,0,product shall store new conference room,0,0.002300276066754324,0,0
6,'The product shall update existing conference rooms.',1,0,0,0,0,0,0,0,0,0,0,0,0,0,product shall update existing conference room,0,0.0004211963491290438,0,0
6,'The product will be able to delete conference rooms.',1,0,0,0,0,0,0,0,0,0,0,0,0,0,product able delete conference room,0,0.11919220769089992,0,0
6,'The product shall be able to store new room equipment.',1,0,0,0,0,0,0,0,0,0,0,0,0,0,product shall able store new room equipment,0,0.001788307665649823,0,0
6,'The product will update existing room equipment.',1,0,0,0,0,0,0,0,0,0,0,0,0,0,product update existing room equipment,0,0.16839885464486384,0,0
6,'The product shall be able to delete room equipment.',1,0,0,0,0,0,0,0,0,0,0,0,0,0,product shall able delete room equipment,0,0.0020148362071787797,0,0
6,'The product shall allow an organizer to invite other employees to meetings.',1,0,0,0,0,0,0,0,0,0,0,0,0,0,product shall allow organizer invite employee meeting,0,0.0031152988323076476,0,0
6,'Each time a conference room is reserved the conference room schedule shall be updated to reflect the time and date of the reservation.',1,0,0,0,0,0,0,0,0,0,0,0,0,0,time conference room reserved conference room schedule shall updated reflect time date reservation,0,0.1421908418524435,0,0
6,'The product shall record the transportation status of equipment reserved.',1,0,0,0,0,0,0,0,0,0,0,0,0,0,product shall record transportation status equipment reserved,0,0.007816203384304122,0,0
6,'The product shall display a map of the company building showing conference room locations.',1,0,0,0,0,0,0,0,0,0,0,0,0,0,product shall display map company building showing conference room location,0,0.006768328900862301,0,0
6,'The product shall record updated meeting agendas.',1,0,0,0,0,0,0,0,0,0,0,0,0,0,product shall record updated meeting agenda,0,0.0014061041910821727,0,0
6,'The product shall send a meeting confirmation to the meeting organizer.',1,0,0,0,0,0,0,0,0,0,0,0,0,0,product shall send meeting confirmation meeting organizer,0,0.013835341335678146,0,0
6,'The product shall display room equipment according to search parameters.',1,0,0,0,0,0,0,0,0,0,0,0,0,0,product shall display room equipment according search parameter,0,0.0035001653758961228,0,0
6,'The product shall display conference rooms according to search parameters.',1,0,0,0,0,0,0,0,0,0,0,0,0,0,product shall display conference room according search parameter,0,0.0013498933657410984,0,0
6,'The product shall record different meeting types.',1,0,0,0,0,0,0,0,0,0,0,0,0,0,product shall record different meeting type,0,0.0017734760969778448,0,0
6,'The product shall record all the equipment that has been reserved.',1,0,0,0,0,0,0,0,0,0,0,0,0,0,product shall record equipment reserved,0,0.003227279419141772,0,0
6,'The product shall notify building personnel of equipment transport requests.',1,0,0,0,0,0,0,0,0,0,0,0,0,0,product shall notify building personnel equipment transport request,0,0.006350240269470507,0,0
6,'The product will allow priviledged users to view meeting schedules in multiple reporting views.',1,0,0,0,0,0,0,0,0,0,0,0,0,0,product allow priviledged user view meeting schedule multiple reporting view,0,0.3223099361402621,0,0
6,'The product shall be able to send meeting notifications via different kinds of end-user specified methods.',1,0,0,0,0,0,0,0,0,0,0,0,0,0,product shall able send meeting notification via different kind enduser specified method,0,0.0011060271482542488,0,0
6,'The product shall have a customizable Look and Feel.',1,1,0,0,0,1,0,0,0,0,0,0,0,0,product shall customizable look feel,0,0.00037564694185216336,0,0
6,'The product shall have an intuitive user interface.',0,1,0,0,0,0,0,0,0,0,0,0,1,0,product shall intuitive user interface,0,0.0003241911007653187,0,0
6,'The product will display an available status for unreserved conference rooms.',1,0,0,0,0,0,0,0,0,0,0,0,0,0,product display available status unreserved conference room,0,0.05185289538297092,0,0
7,'Recreation of Inventory Quantity Adjustment for the period of previous 30 days shall take no more than 30min.',1,1,0,0,0,0,0,0,1,0,0,0,0,0,recreation inventory quantity adjustment period previous NUM day shall take NUM min,0,0.15913519791880693,0,0
7,'The System shall allow for a minimum of 6 users to work at the same time.',0,1,0,0,0,0,0,0,0,0,1,0,0,0,system shall allow minimum NUM user work time,0,0.0016859823864610152,0,0
7,'The System shall utilize currently owned computer equipment.',0,1,0,0,0,0,0,1,0,0,0,0,0,0,system shall utilize currently owned computer equipment,0,0.00643072939500953,0,0
7,'The System shall be able to automatically backup business data and restore them on demand.',1,1,0,1,0,0,0,0,0,0,0,0,0,0,system shall able automatically backup business data restore demand,0,0.005733904183005726,0,0
7,'The System shall maintain consistent security. Any changes in user passwords and/or permissions should take affect in all parts of the System.',0,1,0,0,0,0,0,0,0,0,0,1,0,0,system shall maintain consistent security change user password andor permission take affect part system,0,0.012811012327714507,0,0
7,'The System shall granularly control access rights to all major subsystems. It should be possible to assign access rights to all subsystems independently.',0,1,0,0,0,0,0,0,0,0,0,1,0,0,system shall granularly control access right major subsystem possible assign access right subsystem independently,0,0.014590459713387734,0,0
7,'The System shall meet all applicable accounting standards. The final version of the System must successfully pass independent audit performed by a certified auditor.',0,1,0,0,1,0,1,0,0,0,0,0,0,0,system shall meet applicable accounting standard final version system must successfully pas independent audit performed certified auditor,0,0.005875995120172248,0,0
7,'The System shall not require additional third party licenses resulting in royalty fees.',0,1,0,0,0,0,0,1,0,0,0,0,0,0,system shall require additional third party license resulting royalty fee,0,0.06234734988060315,0,0
7,'The System shall allow generation of Inventory Quantity Adjustment documents on demand.',1,0,0,0,0,0,0,0,0,0,0,0,0,0,system shall allow generation inventory quantity adjustment document demand,0,0.01739511450997492,0,0
7,'The System shall allow on demand generation of all Inventory Quantity Adjustment documents since certain point of time.',1,0,0,0,0,0,0,0,0,0,0,0,0,0,system shall allow demand generation inventory quantity adjustment document since certain point time,0,0.034256230977708704,0,0
7,'The IQA subsystem shall take into account current inventory status and adjust inventory of substitutionary ingredients accordingly.',1,0,0,0,0,0,0,0,0,0,0,0,0,0,iqa subsystem shall take account current inventory status adjust inventory substitutionary ingredient accordingly,0,0.15628666605722094,0,0
7,'The System shall allow entering storing and modifying product formulas.',1,0,0,0,0,0,0,0,0,0,0,0,0,0,system shall allow entering storing modifying product formula,0,0.004233029503456322,0,0
7,'Product formulas shall allow use of semi-products which have own formulas.',1,0,0,0,0,0,0,0,0,0,0,0,0,0,product formula shall allow use semiproducts formula,0,0.001058313504019507,0,0
7,'Product formula ingredients shall allow defining substitutionary ingredients.',1,0,0,0,0,0,0,0,0,0,0,0,0,0,product formula ingredient shall allow defining substitutionary ingredient,0,0.011647033173860713,0,0
7,'Product formula substitutionary ingredients shall be entered automatically by the PFE subsystem.',1,0,0,0,0,0,0,0,0,0,0,0,0,0,product formula substitutionary ingredient shall entered automatically pfe subsystem,0,0.017206604498086562,0,0
7,'Formula substitutionary ingredients shall be kept in persisted order',1,0,0,0,0,0,0,0,0,0,0,0,0,0,formula substitutionary ingredient shall kept persisted order,0,0.12170631652139975,0,0
7,'Product shall allow entering storing and modifying product menus used by POS terminals.',1,0,0,0,0,0,0,0,0,0,0,0,0,0,product shall allow entering storing modifying product menu used po terminal,0,0.00471678176307444,0,0
7,'PME Subsystem shall allow building product menus based on the list of products kept in the accounting system.',1,0,0,0,0,0,0,0,0,0,0,0,0,0,pme subsystem shall allow building product menu based list product kept accounting system,0,0.025606725969698565,0,0
7,'PME Subsystem shall allow keeping submenus within menus and products within submenus in a managed and persisted order.',0,1,0,0,0,1,0,0,0,0,0,0,1,0,pme subsystem shall allow keeping submenu within menu product within submenu managed persisted order,0,0.06349793515885901,0,0
7,'PME Subsystem shall allow for a product to exist in more than one submenu',1,0,0,0,0,0,0,0,0,0,0,0,0,0,pme subsystem shall allow product exist one submenu,0,0.05984110962744422,0,0
7,'The RMS System shall have Windows XP look and feel and use GUI futures making its use intuitive.',0,1,0,0,0,1,0,0,0,0,0,0,1,0,rms system shall window xp look feel use gui future making use intuitive,0,0.0068853930883350165,0,0
7,'The System shall generate Inventory Quantity Adjustment document based on product daily sales data and product formulas.',1,0,0,0,0,0,0,0,0,0,0,0,0,0,system shall generate inventory quantity adjustment document based product daily sale data product formula,0,0.001940507192779323,0,0
7,'The System shall generate Inventory Quantity Adjustment document automatically when daily Product Sales data is available.',1,0,0,0,0,0,0,0,0,0,0,0,0,0,system shall generate inventory quantity adjustment document automatically daily product sale data available,0,0.0035913722524990813,0,0
8,'Administrator shall be able to activate a pre-paid card via the Administration section in under 5 seconds.',1,1,0,0,0,0,0,0,1,0,0,0,1,0,administrator shall able activate prepaid card via administration section NUM second,0,0.058718992274521695,0,0
8,'Customer shall be able to check the status of their prepaid card by entering in the PIN number in under 5 seconds.',1,1,0,0,0,0,0,0,1,0,0,0,1,0,customer shall able check status prepaid card entering pin number NUM second,0,0.10730006705178675,0,0
8,"System shall let customers register on the website as a ""pay as you go"" user in under 5 minutes.'",1,1,0,0,0,0,0,0,1,0,0,0,1,0,system shall let customer register website pay go user NUM minute,0,0.0033880741914930988,0,0
8,"System shall let customers register on the website as a ""unlimited movie subscriber"" user in under 10 minutes.'",1,1,0,0,0,0,0,0,1,0,0,0,1,0,system shall let customer register website unlimited movie subscriber user NUM minute,0,0.004044033083544907,0,0
8,'System shall let existing customers log into the website with their email address and password in under 5 seconds.',1,1,0,0,0,0,0,0,1,0,0,0,1,0,system shall let existing customer log website email address password NUM second,0,0.009603237049833603,0,0
8,'System shall let customers cancel their account process shall take no longer than 2 minutes. Database will mark the account as inactive and user will not be able to log into the website.',1,1,0,0,0,0,0,0,1,0,0,1,1,0,system shall let customer cancel account process shall take longer NUM minute database mark account inactive user able log website,0,0.0005934653923953112,0,0
8,'System shall let administrator de-activate a customer account in under 1 minute. Customer will no longer be able to access the website.',1,1,0,0,0,0,0,0,1,0,0,1,0,0,system shall let administrator deactivate customer account NUM minute customer longer able access website,0,0.0027161808257205595,0,0
8,'System shall let administrator add/remove movies on the website in under 5 minutes. Entered movie information will be stored in the database and will now be available on the website.',1,1,0,0,0,0,0,0,1,0,0,0,1,0,system shall let administrator addremove movie website NUM minute entered movie information stored database available website,0,0.00209047574081364,0,0
8,'System shall let the administrator add/remove categories on the website in under 5 minutes.',1,1,0,0,0,0,0,0,1,0,0,0,1,0,system shall let administrator addremove category website NUM minute,0,0.003266747452835093,0,0
8,'System shall let Izogn Manager access sales and usage statistics in under 2 minutes.',0,1,0,0,0,0,0,0,1,0,0,0,0,0,system shall let izogn manager access sale usage statistic NUM minute,0,0.0197532874201328,0,0
