ProjectID,RequirementText,IsFunctional,IsQuality,Availability (A),Fault Tolerance (FT),Legal (L),Look & Feel (LF),Maintainability (MN),Operability (O),Performance (PE),Portability (PO),Scalability (SC),Security (SE),Usability (US),Other (OT),CleanedRequirementText,IsOutlierRule,OutlierProbability,IsOutlierModel,IsOutlierFinal
1,'The system shall refresh the display every 60 seconds.',1,1,0,0,0,0,0,0,1,0,0,0,0,0,system shall refresh display every NUM second,0,0.000962625207298889,0,0
1,'The application shall match the color of the schema set forth by Department of Homeland Security',0,1,0,0,1,1,0,0,0,0,0,0,0,0,application shall match color schema set forth department homeland security,0,0.15078649168495037,0,0
1,'If projected the data must be readable. On a 10x10 projection screen 90% of viewers must be able to read Event / Activity data from a viewing distance of 30',0,1,0,0,0,1,0,0,0,0,0,0,1,0,projected data must readable NUM x NUM projection screen NUM viewer must able read event activity data viewing distance NUM,0,0.010136087787474211,0,0
1,'The product shall be available during normal business hours. As long as the user has access to the client PC the system will be available 99% of the time during the first six months of operation.',0,1,1,0,0,0,0,0,0,0,0,0,0,0,product shall available normal business hour long user access client pc system available NUM time first six month operation,0,0.0010252744794691509,0,0
1,'If projected the data must be understandable. On a 10x10 projection screen 90% of viewers must be able to determine that Events or Activities are occuring in current time from a viewing distance of 100',0,1,0,0,0,1,0,0,0,0,0,0,1,0,projected data must understandable NUM x NUM projection screen NUM viewer must able determine event activity occuring current time viewing distance NUM,0,0.034571862043714985,0,0
1,'The product shall ensure that it can only be accessed by authorized users. The product will be able to distinguish between authorized and unauthorized users in all access attempts',1,1,0,0,0,0,0,0,0,0,0,1,0,0,product shall ensure accessed authorized user product able distinguish authorized unauthorized user access attempt,0,0.0071113450680467104,0,0
1,'The product shall be intuitive and self-explanatory. : 90% of new users shall be able to start the display of Events or Activities within 90 minutes of using the product.',0,1,0,0,0,0,0,0,0,0,0,0,1,0,product shall intuitive selfexplanatory NUM new user shall able start display event activity within NUM minute using product,0,2.4151992870993876e-05,0,0
1,'The product shall respond fast to keep up-to-date data in the display.',0,1,0,0,0,0,0,0,1,0,0,0,0,0,product shall respond fast keep uptodate data display,0,0.003726473050521545,0,0
1,'The system shall have a MDI form that allows for the viewing of the graph and the data table.',1,0,0,0,0,0,0,0,0,0,0,0,0,0,system shall mdi form allows viewing graph data table,0,0.002101271776458581,0,0
1,'The system shall display Events in a vertical table by time.',1,0,0,0,0,0,0,0,0,0,0,0,0,0,system shall display event vertical table time,0,0.008865585086013025,0,0
1,'The system shall display the Events in a graph by time.',1,0,0,0,0,0,0,0,0,0,0,0,0,0,system shall display event graph time,0,0.0033436174262925053,0,0
1,'The system shall display Events or Activities.',1,0,0,0,0,0,0,0,0,0,0,0,0,0,system shall display event activity,0,0.000494542710464544,0,0
1,'The display shall have two regions: left 2/3 of the display is graphical right 1/3 of the display is a data table',0,1,0,0,0,1,0,0,0,0,0,0,0,0,display shall two region left NUM display graphical right NUM display data table,0,0.036015301173699533,0,0
1,'The data displayed in both the nodes within the graph and the rows in the table are MSEL Summary data',0,0,0,0,0,0,0,0,0,0,0,0,0,0,data displayed node within graph row table msel summary data,0,0.39069481401384787,0,0
1,'The table side of the display shall be split into 2 regions: sequential and temporal.',0,1,0,0,0,1,0,0,0,0,0,0,0,0,table side display shall split NUM region sequential temporal,0,0.02062109939067356,0,0
1,'The system shall color code events according to their variance from current time.',1,1,0,0,0,1,0,0,0,0,0,0,0,0,system shall color code event according variance current time,0,0.005723789462912499,0,0
1,'The system shall display data from the Sync Matrix 1.0 and Exercise Management Tool 1.0 applications',1,1,0,0,0,1,0,0,0,0,0,0,0,0,system shall display data sync matrix NUM exercise management tool NUM application,0,0.003271040197977279,0,0
1,'The system shall link Events back to either the Sync Matrix 1.0 or the Exercise Managment Tool 1.0 applications for modifications.',1,1,0,0,0,0,1,0,0,1,0,0,0,0,system shall link event back either sync matrix NUM exercise managment tool NUM application modification,0,0.020308771422448565,0,0
1,'The system shall allow modification of the display.',1,0,0,0,0,0,0,0,0,0,0,0,0,0,system shall allow modification display,0,0.0015083280867244796,0,0
1,'The system shall offer a display of all the Events in the exercise.',1,0,0,0,0,0,0,0,0,0,0,0,0,0,system shall offer display event exercise,0,0.006270329634456349,0,0
1,'The system shall filter data by: Venues and Key Events.',1,0,0,0,0,0,0,0,0,0,0,0,0,0,system shall filter data venue key event,0,0.001238965176840226,0,0
1,'The system shall allow a user to define the time segments',1,0,0,0,0,0,0,0,0,0,0,0,0,0,system shall allow user define time segment,0,0.0010598448002990843,0,0
1,'The system shall display the local and exercise time in separate clocks',1,0,0,0,0,0,0,0,0,0,0,0,0,0,system shall display local exercise time separate clock,0,0.014959161220573556,0,0
1,'The system shall offer the ability to pause and resume the refresh of data.',1,0,0,0,0,0,0,0,0,0,0,0,0,0,system shall offer ability pause resume refresh data,0,0.010577342670457936,0,0
1,'The system shall provide charts for the Activity or Event actual versus assumed time.',1,0,0,0,0,0,0,0,0,0,0,0,0,0,system shall provide chart activity event actual versus assumed time,0,0.00871541566947877,0,0
1,'The system shall provide a history report of changes made to the Activity or Event data',1,0,0,0,0,0,0,0,0,0,0,0,0,0,system shall provide history report change made activity event data,0,0.001390680532473704,0,0
2,'The look and feel of the system shall conform to the user interface standards of the smart device.',0,1,0,0,0,1,0,0,0,0,0,0,0,0,look feel system shall conform user interface standard smart device,0,0.005838286433126859,0,0
2,'The user interface shall have standard menus buttons for navigation',0,1,0,0,0,1,0,0,0,0,0,0,0,0,user interface shall standard menu button navigation,0,0.0064575729721972255,0,0
2,'The system shall have a professional appearance',0,1,0,0,0,1,0,0,0,0,0,0,0,0,system shall professional appearance,0,0.0012194209073966061,0,0
2,'The product shall have a consistent color scheme and fonts.',0,1,0,0,0,1,0,0,0,0,0,0,0,0,product shall consistent color scheme font,0,0.001926404008808076,0,0
2,'The system shall be used by realtors with no training.',0,1,0,0,0,0,0,0,0,0,0,0,1,0,system shall used realtor training,0,0.004407827732833228,0,0
2,'The system shall be intuitive and self explanatory.',0,1,0,0,0,0,0,0,0,0,0,0,1,0,system shall intuitive self explanatory,0,0.002003319692376065,0,0
2,'The product shall be easy for a realtor to learn.',0,1,0,0,0,0,0,0,0,0,0,0,1,0,product shall easy realtor learn,0,0.0024746966567061757,0,0
2,'The product shall use symbols and words that are naturally understandable by the realtor community.',0,1,0,0,0,1,0,0,0,0,0,0,1,0,product shall use symbol word naturally understandable realtor community,0,0.013082365485050831,0,0
2,'The product shall produce search results in an acceptable time',1,1,0,0,0,0,0,0,1,0,0,0,0,0,product shall produce search result acceptable time,0,0.0064954945433412185,0,0
2,'The search results shall be returned no later 30 seconds after the user has entered the search criteria',1,1,0,0,0,0,0,0,1,0,0,0,0,0,search result shall returned later NUM second user entered search criterion,0,0.029183739261267643,0,0
2,'The product shall generate a CMA report in an acceptable time.',1,1,0,0,0,0,0,0,1,0,0,0,0,0,product shall generate cma report acceptable time,0,0.020884357968137365,0,0
2,'The CMA report shall be returned no later 60 seconds after the user has entered the CMA report criteria.',1,1,0,0,0,0,0,0,1,0,0,0,0,0,cma report shall returned later NUM second user entered cma report criterion,0,0.140108360575848,0,0
2,'The product shall synchronize contacts and appointments in an acceptable time.',1,1,0,0,0,0,0,0,1,0,0,0,0,0,product shall synchronize contact appointment acceptable time,0,0.0029384901504665895,0,0
2,'The product shall synchronize with the office system every hour.',1,1,0,0,0,0,0,0,1,0,0,0,0,0,product shall synchronize office system every hour,0,5.6253222832428865e-05,0,0
2,'The product shall be available for use 24 hours per day 365 days per year',0,1,1,0,0,0,0,0,0,0,0,0,0,0,product shall available use NUM hour per day NUM day per year,0,0.0023833837471906876,0,0
2,'Out of 1000 accesses to the system the system is available 999 times.',0,1,1,0,0,0,0,0,0,0,0,0,0,0,NUM access system system available NUM time,0,0.06289759919944148,0,0
2,'The product shall operate in offline mode whenever internet connection is unavailable.',0,1,0,1,0,0,0,0,0,0,0,0,0,0,product shall operate offline mode whenever internet connection unavailable,0,0.03430930958105378,0,0
2,'The product shall allow the user to view previously downloaded search results CMA reports and appointments.',1,0,0,0,0,0,0,0,0,0,0,0,0,0,product shall allow user view previously downloaded search result cma report appointment,0,0.0008120347235925008,0,0
2,'The product shall retain user preferences in the event of a failure.',1,0,0,0,0,0,0,0,0,0,0,0,0,0,product shall retain user preference event failure,0,0.0014002619180923275,0,0
2,'100% of saved user preferences shall be restored when system comes back online.',1,1,0,1,0,0,0,0,0,0,0,0,0,0,NUM saved user preference shall restored system come back online,0,0.0035802293529418284,0,0
2,'The product shall be able to support multiple remote users',1,0,0,0,0,0,0,0,0,0,0,0,0,0,product shall able support multiple remote user,0,0.000958164681933476,0,0
2,'The product shall be able support 1000 simultaneous users.',0,1,0,0,0,0,0,0,0,0,1,0,0,0,product shall able support NUM simultaneous user,0,0.00015175630499686488,0,0
2,'The product shall be capable of handling the existing 1000 users. This number is expected to grow 5 times within the next year.',0,1,0,0,0,0,0,0,1,0,1,0,0,0,product shall capable handling existing NUM user number expected grow NUM time within next year,0,0.01639661094456918,0,0
2,'The product shall be installed by an untrained realtor without recourse to separately-printed instructions.',0,1,0,0,0,0,0,0,0,0,0,0,1,0,product shall installed untrained realtor without recourse separatelyprinted instruction,0,0.014855290471461073,0,0
2,'90% of untrained realtors shall be able to install the product on their device without printed instructions',0,1,0,0,0,0,0,0,0,0,0,0,1,0,NUM untrained realtor shall able install product device without printed instruction,0,0.012018027916013432,0,0
2,'Only registered realtors shall be able to access the system.',0,1,0,0,0,0,0,0,0,0,0,1,0,0,registered realtor shall able access system,0,0.0003833466977960588,0,0
2,'Every user of the system shall be authenticated and authorized.',1,1,0,0,0,0,0,0,0,0,0,1,0,0,every user system shall authenticated authorized,0,0.0002255716928021189,0,0
2,'The product shall prevent its data from incorrect data being introduced.',0,1,0,0,0,0,0,0,0,0,0,1,0,0,product shall prevent data incorrect data introduced,0,0.003907193957073771,0,0
2,'The system shall allow a real estate agent to query MLS information',1,0,0,0,0,0,0,0,0,0,0,0,0,0,system shall allow real estate agent query ml information,0,0.010711109760573975,0,0
2,'The user shall be able to get driving directions to a selected property',1,0,0,0,0,0,0,0,0,0,0,0,0,0,user shall able get driving direction selected property,0,0.013962950490357087,0,0
2,'The user shall be able to download appointments and contact information for clients',1,0,0,0,0,0,0,0,0,0,0,0,0,0,user shall able download appointment contact information client,0,0.006295159686899563,0,0
2,'The system shall display clear property images in the search results',1,0,0,0,0,0,0,0,0,0,0,0,0,0,system shall display clear property image search result,0,0.008799512959482596,0,0
2,'The system shall update or create new property listings in the MLS',1,0,0,0,0,0,0,0,0,0,0,0,0,0,system shall update create new property listing ml,0,0.014923379793456967,0,0
2,'Realtor shall be able to generate a CMA report based on property criteria',1,0,0,0,0,0,0,0,0,0,0,0,0,0,realtor shall able generate cma report based property criterion,0,0.07206001193135328,0,0
2,'The system shall be able to call the seller or buyer to schedule an appointment',1,0,0,0,0,0,0,0,0,0,0,0,0,0,system shall able call seller buyer schedule appointment,0,0.015987100530575546,0,0
2,'The realtor shall be notified of new client appointments after automatic synchronization with office system',1,0,0,0,0,0,0,0,0,0,0,0,0,0,realtor shall notified new client appointment automatic synchronization office system,0,0.05701778756226742,0,0
2,'The realtor shall be able to retrieve a map showing property locations for a specified area',1,0,0,0,0,0,0,0,0,0,0,0,0,0,realtor shall able retrieve map showing property location specified area,0,0.1310280264779977,0,0
2,'The system shall notify the realtor when a seller or buyer responds to an appointment request',1,0,0,0,0,0,0,0,0,0,0,0,0,0,system shall notify realtor seller buyer responds appointment request,0,0.03680964091577873,0,0
2,'The product shall allow the user to save the property search results.',1,0,0,0,0,0,0,0,0,0,0,0,0,0,product shall allow user save property search result,0,0.00042382193924272624,0,0
3,'The system shall be easy to use by the Program Administrators/Nursing Staff Members.',0,1,0,0,0,0,0,0,0,0,0,0,1,0,system shall easy use program administratorsnursing staff member,0,0.0029728689582556606,0,0
3,'All of the users shall be able to use the system after one day of training.',0,1,0,0,0,0,0,0,0,0,0,0,1,0,user shall able use system one day training,0,0.0023269374455313296,0,0
3,'The system shall help the user avoid making mistakes while scheduling classes and clinicals for the nursing students.',0,1,0,0,0,0,0,0,0,0,0,0,1,0,system shall help user avoid making mistake scheduling class clinicals nursing student,0,0.006828600447181679,0,0
3,'The number of mistakes noted by the students shall be decreased by 50% in the first year.',0,1,0,0,0,0,0,0,0,0,0,0,1,0,number mistake noted student shall decreased NUM first year,0,0.1616525332762779,0,0
3,'The system shall be intuitive to the Program Administrators/Nursing Staff Members.',0,1,0,0,0,0,0,0,0,0,0,0,1,0,system shall intuitive program administratorsnursing staff member,0,0.004539738852568763,0,0
3,'2 out of 3 Program Administrators/Nursing Staff Members shall successfully be able to use the system to manage the scheduling of classes and clinicals.',1,1,0,0,0,0,0,0,0,0,0,0,1,0,NUM NUM program administratorsnursing staff member shall successfully able use system manage scheduling class clinicals,0,0.025071790694686784,0,0
3,'The system shall use symbols and words that are naturally understandable by the user community.',0,1,0,0,0,1,0,0,0,0,0,0,1,0,system shall use symbol word naturally understandable user community,0,0.004491264505001065,0,0
3,'The verbiage used within the system shall be consistent with Standard English and the terminology of the national Nursing Community.',0,1,0,0,0,1,0,0,0,0,0,0,1,0,verbiage used within system shall consistent standard english terminology national nursing community,0,0.0032758557612852647,0,0
3,'Staff members shall be able to complete a set of tasks in a timely manner.',0,1,0,0,0,0,0,0,1,0,0,0,0,0,staff member shall able complete set task timely manner,0,0.058506708053322164,0,0
3,'The response time of general student management tasks shall take no longer than 5 seconds and the response time of schedule generation shall take no longer than 30 seconds.',0,1,0,0,0,0,0,0,1,0,0,0,0,0,response time general student management task shall take longer NUM second response time schedule generation shall take longer NUM second,0,0.07591146001943061,0,0
3,'The system shall be available for use between the hours of 8am and 6pm.',0,1,1,0,0,0,0,0,0,0,0,0,0,0,system shall available use hour NUM am NUM pm,0,5.5575391599653186e-05,0,0
3,'The system shall achieve 95% up time.',0,1,1,0,0,0,0,0,0,0,0,0,0,0,system shall achieve NUM time,0,0.0030846321931860083,0,0
3,'system shall be able to handle all of the user requests/usage during business hours.',0,1,1,0,0,0,0,0,0,0,1,0,0,0,system shall able handle user requestsusage business hour,0,0.00038467779671496087,0,0
3,'The system shall cater to 10 simultaneous users from 9am to 5pm.',0,1,1,0,0,0,0,0,0,0,1,0,0,0,system shall cater NUM simultaneous user NUM am NUM pm,0,0.00029917947008721254,0,0
3,'The system shall be capable of processing 100% of nursing students and their classes for the next 10 years.',0,1,0,0,0,0,0,0,0,0,1,0,0,0,system shall capable processing NUM nursing student class next NUM year,0,0.005883865915755751,0,0
3,'The system shall be expected to manage the nursing program curriculum and class/clinical scheduling for a minimum of 5 years.',1,1,0,0,0,0,0,0,0,0,1,0,0,0,system shall expected manage nursing program curriculum classclinical scheduling minimum NUM year,0,0.016027880640890335,0,0
3,'The system shall able to operate within a business office environment typical of the Nursing Department at DePaul University.',0,1,0,0,0,0,0,1,0,0,0,0,0,0,system shall able operate within business office environment typical nursing department depaul university,0,0.025859363369593356,0,0
3,'The system shall be used within the specifications defined by the computers used by the Program Administrators/Nursing Staff Members.',0,1,0,0,0,0,0,1,0,0,0,0,0,0,system shall used within specification defined computer used program administratorsnursing staff member,0,0.0041525143539203665,0,0
3,'The system shall operate within the Windows XP Professional operating system.',0,1,0,0,0,0,0,1,0,0,0,0,0,0,system shall operate within window xp professional operating system,0,0.005962403216618216,0,0
3,The system shall interface with CampusConnect's central server',0,1,0,0,0,0,0,1,0,0,0,0,0,0,system shall interface campusconnects central server,0,0.0016925556785882775,0,0
3,'The system shall interface with the faculty central server.',0,1,0,0,0,0,0,1,0,0,0,0,0,0,system shall interface faculty central server,0,0.004520354362663259,0,0
3,'The system shall interface with the student master server.',0,1,0,0,0,0,0,1,0,0,0,0,0,0,system shall interface student master server,0,0.0014515107418493866,0,0
3,'We must be able to interface with any HTML browser.',0,1,0,0,0,0,0,1,0,0,0,0,0,0,must able interface html browser,0,0.0614129899579207,0,0
3,'Only authorized users shall have access to clinical site information.',0,1,0,0,0,0,0,0,0,0,0,1,0,0,authorized user shall access clinical site information,0,0.004059705203271141,0,0
3,'Program Administrators/Nursing Staff Members are the only people who shall have access to clinical site details.',0,1,0,0,0,0,0,0,0,0,0,1,0,0,program administratorsnursing staff member people shall access clinical site detail,0,0.022286864925010114,0,0
3,Only authorized users shall have access to students' personal information.',0,1,0,0,0,0,0,0,0,0,0,1,0,0,authorized user shall access student personal information,0,0.010439656400163115,0,0
3,Dr Susan Poslusny and Dr Julie Donalek are the only people who shall have access to students' personal information.',0,1,0,0,0,0,0,0,0,0,0,1,0,0,dr susan poslusny dr julie donalek people shall access student personal information,0,0.15462978090744772,0,0
3,'Only authorized users shall have access to the portion of the system that interfaces with CampusConnect.',0,1,0,0,0,0,0,0,0,0,0,1,0,0,authorized user shall access portion system interface campusconnect,0,0.0010277721597952325,0,0
3,'Fit Criterion: Dr Susan Poslusny and Karen Sysol are the only people who shall have access to the final class section scheduling for the system that interfaces with CampusConnect.',0,1,0,0,0,0,0,0,0,0,0,1,0,0,fit criterion dr susan poslusny karen sysol people shall access final class section scheduling system interface campusconnect,0,0.04955442003170192,0,0
3,'The system shall have basic data integrity checking to reduce the possibility of incorrect or invalid data being introduced.',1,1,0,0,0,0,0,0,0,0,0,1,0,0,system shall basic data integrity checking reduce possibility incorrect invalid data introduced,0,0.02068653871438636,0,0
3,The system shall protect private information in accordance with the organization's information policy.',1,1,0,0,1,0,0,0,0,0,0,1,0,0,system shall protect private information accordance organization information policy,0,0.024746006473558468,0,0
3,'The system shall be built such that it is as secure as possible from malicious interference.',0,1,0,0,0,0,0,0,0,0,0,1,0,0,system shall built secure possible malicious interference,0,0.011797466883097511,0,0
3,The system shall use the organization's standard virus protection software to help monitor threats to itself.',0,1,0,0,0,0,0,0,0,0,0,1,0,0,system shall use organization standard virus protection software help monitor threat,0,0.018695687757096943,0,0
3,'A cohort shall be associated to one Program of Study offered by the department.',1,0,0,0,0,0,0,0,0,0,0,0,0,0,cohort shall associated one program study offered department,0,0.06425612168630164,0,0
3,'Program Administrators and Nursing Staff Members shall be able to add a listing of students to a cohort.',1,0,0,0,0,0,0,0,0,0,0,0,0,0,program administrator nursing staff member shall able add listing student cohort,0,0.03262584278769861,0,0
3,'Program Administrators and Nursing Staff Members shall be able to add a single student to a cohort',1,0,0,0,0,0,0,0,0,0,0,0,0,0,program administrator nursing staff member shall able add single student cohort,0,0.017623771492944276,0,0
3,Students added to a cohort shall be eligible for the cohort's Program of Study.',1,0,0,0,0,0,0,0,0,0,0,0,0,0,student added cohort shall eligible cohort program study,0,0.10673059400822206,0,0
3,'Program Administrators and Nursing Staff Members shall be able to specify the preferred sequence of classes for a given cohort.',1,0,0,0,0,0,0,0,0,0,0,0,0,0,program administrator nursing staff member shall able specify preferred sequence class given cohort,0,0.05003338743650909,0,0
3,'For each class within a sequence for a cohort Program Administrators and Nursing Staff Members shall be able to specify which quarter that class will be offered.',1,0,0,0,0,0,0,0,0,0,0,0,0,0,class within sequence cohort program administrator nursing staff member shall able specify quarter class offered,0,0.01800822612497003,0,0
3,'Program Administrators and Nursing Staff Members shall be able to add new classes to a sequence of classes',1,0,0,0,0,0,0,0,0,0,0,0,0,0,program administrator nursing staff member shall able add new class sequence class,0,0.057893575456857624,0,0
3,'Program Administrators and Nursing Staff Members shall be able to add clinical classes or sections to a sequence of classes',1,0,0,0,0,0,0,0,0,0,0,0,0,0,program administrator nursing staff member shall able add clinical class section sequence class,0,0.020393511190676672,0,0
3,'Program Administrators and Nursing Staff Members shall be able to add a new cohort to the system identified by start month and year.',1,0,0,0,0,0,0,0,0,0,0,0,0,0,program administrator nursing staff member shall able add new cohort system identified start month year,0,0.029879649618502414,0,0
3,'Program Administrators and Nursing Staff Members shall be able to add new classes for the nursing department into the system.',1,0,0,0,0,0,0,0,0,0,0,0,0,0,program administrator nursing staff member shall able add new class nursing department system,0,0.0474280416582194,0,0
3,'A class shall be either a non-clinical class or a clinical class.',0,0,0,0,0,0,0,0,0,0,0,0,0,0,class shall either nonclinical class clinical class,0,0.09898853389508495,0,0
3,'A non-clinical class shall specify the course name lecture room requirements and instructor needs.',0,0,0,0,0,0,0,0,0,0,0,0,0,0,nonclinical class shall specify course name lecture room requirement instructor need,0,0.07374994319899451,0,0
3,'A clinical class shall specify the course name lecture room requirements clinical site needs lecture instructor needs and clinical lab instructor needs.',0,0,0,0,0,0,0,0,0,0,0,0,0,0,clinical class shall specify course name lecture room requirement clinical site need lecture instructor need clinical lab instructor need,0,0.10047864619764145,0,0
3,'Program Administrators/Nursing Staff Members shall be able to create a new Program of Study.',1,0,0,0,0,0,0,0,0,0,0,0,0,0,program administratorsnursing staff member shall able create new program study,0,0.07102347263003116,0,0
3,'A Program of Study shall consist of a program name and listing of required classes (both clinical and non-clinical) that must be completed.',0,0,0,0,0,0,0,0,0,0,0,0,0,0,program study shall consist program name listing required class clinical nonclinical must completed,0,0.012856587585976041,0,0
3,'Program Administrators and Nursing Staff Members shall have the ability to specify which classes are required for a Program of Study',1,0,0,0,0,0,0,0,0,0,0,0,0,0,program administrator nursing staff member shall ability specify class required program study,0,0.08512774720314467,0,0
