ProjectID,RequirementText,IsFunctional,IsQuality,Availability (A),Fault Tolerance (FT),Legal (L),Look & Feel (LF),Maintainability (MN),Operability (O),Performance (PE),Portability (PO),Scalability (SC),Security (SE),Usability (US),Other (OT),CleanedRequirementText,IsOutlierRule,OutlierProbability,IsOutlierModel,IsOutlierFinal
SYN-288,Carpooling platform must support elastic load balancing for 10x growth in Islamabad users.,0,1,0,0,0,0,0,0,0,0,1,0,0,0,carpooling platform must support elastic load balancing NUM x growth islamabad user,0,0.030773921442557767,0,0
SYN-289,Student exchange system must use JWT-based authentication for all API calls.,0,1,0,0,0,0,0,0,0,0,0,1,0,0,student exchange system must use jwtbased authentication api call,0,0.008347943845988137,0,0
SYN-290,Delivery app’s checkout flow must have large touch targets for 10-inch tablet users.,0,1,0,0,0,0,0,0,0,0,0,0,1,0,delivery apps checkout flow must large touch target NUM inch tablet user,0,0.0362787885554372,0,0
SYN-291,The carpooling network must support failover to backup servers within 30 seconds.,0,1,1,0,0,0,0,0,0,0,0,0,0,0,carpooling network must support failover backup server within NUM second,0,0.01410173374325703,0,0
SYN-292,Restaurant system must store order state locally for offline recovery after tablet reboot.,0,1,0,1,0,0,0,0,0,0,0,0,0,0,restaurant system must store order state locally offline recovery tablet reboot,0,0.022620674531193267,0,0
SYN-293,Carpooling app must adhere to Islamabad regional fare collection legal standards.,0,1,0,0,1,0,0,0,0,0,0,0,0,0,carpooling app must adhere islamabad regional fare collection legal standard,0,0.020687818372848724,0,0
SYN-294,Delivery tablet interface must use high-contrast fonts for outdoor restaurant use.,0,1,0,0,0,1,0,0,0,0,0,0,0,0,delivery tablet interface must use highcontrast font outdoor restaurant use,0,0.01316517427618072,0,0
SYN-295,Exchange portal logs must be structured for easy debugging by university IT staff.,0,1,0,0,0,0,1,0,0,0,0,0,0,0,exchange portal log must structured easy debugging university staff,0,0.016244572908246793,0,0
SYN-296,Student portal must provide voice-over guidance for visually impaired users.,0,1,0,0,0,0,0,1,0,0,0,0,0,0,student portal must provide voiceover guidance visually impaired user,0,0.017316206910239374,0,0
SYN-297,Carpooling ride matching must process 100 requests per second without latency spikes.,0,1,0,0,0,0,0,0,1,0,0,0,0,0,carpooling ride matching must process NUM request per second without latency spike,0,0.014463457153018014,0,0
SYN-298,Delivery app must adapt layout seamlessly between 10-inch and 12-inch tablet screens.,0,1,0,0,0,0,0,0,0,1,0,0,0,0,delivery app must adapt layout seamlessly NUM inch NUM inch tablet screen,0,0.009853460636788934,0,0
SYN-299,University exchange portal must horizontally scale to 5000 concurrent student sessions.,0,1,0,0,0,0,0,0,0,0,1,0,0,0,university exchange portal must horizontally scale NUM concurrent student session,0,0.011022803558450953,0,0
SYN-300,Carpooling payment module must encrypt payloads using TLS 1.3.,0,1,0,0,0,0,0,0,0,0,0,1,0,0,carpooling payment module must encrypt payload using tl NUM,0,0.015249564218067755,0,0
SYN-301,Restaurant order confirmation must be reachable within three taps on tablet.,0,1,0,0,0,0,0,0,0,0,0,0,1,0,restaurant order confirmation must reachable within three tap tablet,0,0.026245862880497926,0,0
SYN-302,Islamabad carpooling service must have 99.99% uptime during Friday peak hours.,0,1,1,0,0,0,0,0,0,0,0,0,0,0,islamabad carpooling service must NUM uptime friday peak hour,0,0.01702924832011549,0,0
SYN-303,Delivery system must retry failed API calls up to 3 times with exponential backoff.,0,1,0,1,0,0,0,0,0,0,0,0,0,0,delivery system must retry failed api call NUM time exponential backoff,0,0.015390370042077935,0,0
SYN-304,Exchange portal must retain student data according to Islamabad data residency laws.,0,1,0,0,1,0,0,0,0,0,0,0,0,0,exchange portal must retain student data according islamabad data residency law,0,0.006256915658679712,0,0
SYN-305,Carpooling map markers must be custom-designed for Islamabad road network clarity.,0,1,0,0,0,1,0,0,0,0,0,0,0,0,carpooling map marker must customdesigned islamabad road network clarity,0,0.02549186877715093,0,0
SYN-306,Restaurant backend must allow dynamic addition of new delivery zones without redeployment.,0,1,0,0,0,0,1,0,0,0,0,0,0,0,restaurant backend must allow dynamic addition new delivery zone without redeployment,0,0.019886329545047345,0,0
SYN-307,Student portal must support drag-and-drop course registration with confirmation popups.,0,1,0,0,0,0,0,1,0,0,0,0,0,0,student portal must support draganddrop course registration confirmation popups,0,0.012993845039797888,0,0
SYN-308,Carpooling real-time location updates must have latency under 1 second.,0,1,0,0,0,0,0,0,1,0,0,0,0,0,carpooling realtime location update must latency NUM second,0,0.0166060614496133,0,0
SYN-309,Delivery app must run on Samsung and Lenovo 10-inch tablets with same features.,0,1,0,0,0,0,0,0,0,1,0,0,0,0,delivery app must run samsung lenovo NUM inch tablet feature,0,0.017968039061876714,0,0
SYN-310,University portal must auto-scale compute resources for semester registration peaks.,0,1,0,0,0,0,0,0,0,0,1,0,0,0,university portal must autoscale compute resource semester registration peak,0,0.03681893689923392,0,0
SYN-311,Carpooling driver profiles must use biometric authentication for identity verification.,0,1,0,0,0,0,0,0,0,0,0,1,0,0,carpooling driver profile must use biometric authentication identity verification,0,0.004410948665523733,0,0
SYN-312,Restaurant tablet UI must have minimum 44x44 pixel touch targets for all buttons.,0,1,0,0,0,0,0,0,0,0,0,0,1,0,restaurant tablet ui must minimum NUM x NUM pixel touch target button,0,0.03697317397940673,0,0
SYN-313,Islamabad carpooling network must have hot standby replication for real-time ride data.,0,1,1,0,0,0,0,0,0,0,0,0,0,0,islamabad carpooling network must hot standby replication realtime ride data,0,0.026483986168616854,0,0
SYN-314,Delivery order system must handle sudden tablet power loss without corrupting open orders.,0,1,0,1,0,0,0,0,0,0,0,0,0,0,delivery order system must handle sudden tablet power loss without corrupting open order,0,0.008830847867685962,0,0
SYN-315,Carpooling app must display enforceable terms of service for Islamabad regional commuters.,0,1,0,0,1,0,0,0,0,0,0,0,0,0,carpooling app must display enforceable term service islamabad regional commuter,0,0.0041162128169182815,0,0
SYN-316,Restaurant dashboard must use circular progress indicators for food preparation time.,0,1,0,0,0,1,0,0,0,0,0,0,0,0,restaurant dashboard must use circular progress indicator food preparation time,0,0.05764379629666394,0,0
SYN-317,Exchange portal’s microservices must have versioned APIs for backward compatibility.,0,1,0,0,0,0,1,0,0,0,0,0,0,0,exchange portal microservices must versioned apis backward compatibility,0,0.05978702702329319,0,0
SYN-318,Student exchange system must provide keyboard shortcuts for power users.,0,1,0,0,0,0,0,1,0,0,0,0,0,0,student exchange system must provide keyboard shortcut power user,0,0.011718626975220072,0,0
SYN-319,Carpooling search results must load in under 800ms for 2000 daily active users.,0,1,0,0,0,0,0,0,1,0,0,0,0,0,carpooling search result must load NUM m NUM daily active user,0,0.04224596803168498,0,0
SYN-320,Delivery tablet app must be distributable via both Google Play and Apple App Store.,0,1,0,0,0,0,0,0,0,1,0,0,0,0,delivery tablet app must distributable via google play apple app store,0,0.025486786176259265,0,0
SYN-322,Carpooling payment gateway must prevent SQL injection and XSS attacks.,0,1,0,0,0,0,0,0,0,0,0,1,0,0,carpooling payment gateway must prevent sql injection xss attack,0,0.03201068601777227,0,0
SYN-323,Restaurant order tracking must show real-time status with intuitive icons on tablet.,0,1,0,0,0,0,0,0,0,0,0,0,1,0,restaurant order tracking must show realtime status intuitive icon tablet,0,0.07807836174455864,0,0
SYN-324,Islamabad carpooling must have 99.95% availability during heavy rain disruptions.,0,1,1,0,0,0,0,0,0,0,0,0,0,0,islamabad carpooling must NUM availability heavy rain disruption,0,0.013629330893193885,0,0
SYN-325,Delivery system must use circuit breakers to prevent cascading failures.,0,1,0,1,0,0,0,0,0,0,0,0,0,0,delivery system must use circuit breaker prevent cascading failure,0,0.0031792792027760873,0,0
SYN-326,Student portal must follow FERPA-like privacy laws for Islamabad student data.,0,1,0,0,1,0,0,0,0,0,0,0,0,0,student portal must follow ferpalike privacy law islamabad student data,0,0.01249129853161912,0,0
SYN-327,Carpooling app must use skeuomorphic design for car selection screen.,0,1,0,0,0,1,0,0,0,0,0,0,0,0,carpooling app must use skeuomorphic design car selection screen,0,0.008444667215982953,0,0
SYN-328,Delivery backend must have comprehensive logging for all order state changes.,0,1,0,0,0,0,1,0,0,0,0,0,0,0,delivery backend must comprehensive logging order state change,0,0.07648279064420524,0,0
SYN-329,University exchange portal must provide contextual help tooltips for each form field.,0,1,0,0,0,0,0,1,0,0,0,0,0,0,university exchange portal must provide contextual help tooltips form field,0,0.014075552058231593,0,0
SYN-330,Carpooling fare calculation must complete within 500ms for 100 simultaneous trips.,0,1,0,0,0,0,0,0,1,0,0,0,0,0,carpooling fare calculation must complete within NUM m NUM simultaneous trip,0,0.0254840490611466,0,0
SYN-331,Restaurant tablet app must support screen rotation from portrait to landscape.,0,1,0,0,0,0,0,0,0,1,0,0,0,0,restaurant tablet app must support screen rotation portrait landscape,0,0.017769345352845724,0,0
SYN-333,Carpooling driver data must be hashed using bcrypt for storage.,0,1,0,0,0,0,0,0,0,0,0,1,0,0,carpooling driver data must hashed using bcrypt storage,0,0.013637493620736293,0,0
SYN-334,Delivery app must use consistent bottom navigation bar across all tablet screens.,0,1,0,0,0,0,0,0,0,0,0,0,1,0,delivery app must use consistent bottom navigation bar across tablet screen,0,0.008457146159446843,0,0
SYN-335,Islamabad carpooling must support automatic failover to secondary data center.,0,1,1,0,0,0,0,0,0,0,0,0,0,0,islamabad carpooling must support automatic failover secondary data center,0,0.007471758367922675,0,0
SYN-336,Restaurant order system must preserve cart state after network disconnection.,0,1,0,1,0,0,0,0,0,0,0,0,0,0,restaurant order system must preserve cart state network disconnection,0,0.05672748134300788,0,0
SYN-337,Carpooling platform must retain trip records for 5 years per Islamabad transport law.,0,1,0,0,1,0,0,0,0,0,0,0,0,0,carpooling platform must retain trip record NUM year per islamabad transport law,0,0.031409165770214964,0,0
SYN-338,Delivery tablet interface must use animated transitions between menu categories.,0,1,0,0,0,1,0,0,0,0,0,0,0,0,delivery tablet interface must use animated transition menu category,0,0.011156060481853516,0,0
SYN-339,Exchange portal must have self-healing scripts for common database connection issues.,0,1,0,0,0,0,1,0,0,0,0,0,0,0,exchange portal must selfhealing script common database connection issue,0,0.006615403271003735,0,0
SYN-340,Student portal must support one-tap document scanning from tablet camera.,0,1,0,0,0,0,0,1,0,0,0,0,0,0,student portal must support onetap document scanning tablet camera,0,0.011725571548228392,0,0
SYN-341,Carpooling routing engine must handle 5000 waypoint calculations per second.,0,1,0,0,0,0,0,0,1,0,0,0,0,0,carpooling routing engine must handle NUM waypoint calculation per second,0,0.013092512682878546,0,0
SYN-342,Delivery app must work on Huawei and Apple tablets without vendor lock-in.,0,1,0,0,0,0,0,0,0,1,0,0,0,0,delivery app must work huawei apple tablet without vendor lockin,0,0.05667104842674727,0,0
SYN-344,Carpooling chat messages must be end-to-end encrypted.,0,1,0,0,0,0,0,0,0,0,0,1,0,0,carpooling chat message must endtoend encrypted,0,0.021201926616626184,0,0
SYN-345,Restaurant tablet UI must have undo option for accidental order deletions.,0,1,0,0,0,0,0,0,0,0,0,0,1,0,restaurant tablet ui must undo option accidental order deletion,0,0.030988486306707714,0,0
SYN-346,Islamabad carpooling must have redundant network links for continuous operation.,0,1,1,0,0,0,0,0,0,0,0,0,0,0,islamabad carpooling must redundant network link continuous operation,0,0.01470383618712655,0,0
SYN-347,Delivery system must use dead letter queues for failed order processing.,0,1,0,1,0,0,0,0,0,0,0,0,0,0,delivery system must use dead letter queue failed order processing,0,0.009099393938667362,0,0
SYN-348,Carpooling app must comply with Islamabad anti-discrimination transport policies.,0,1,0,0,1,0,0,0,0,0,0,0,0,0,carpooling app must comply islamabad antidiscrimination transport policy,0,0.007069566416202328,0,0
SYN-349,Restaurant dashboard must use rounded corners and shadow effects for modern look.,0,1,0,0,0,1,0,0,0,0,0,0,0,0,restaurant dashboard must use rounded corner shadow effect modern look,0,0.047944976624024215,0,0
SYN-350,Exchange portal’s database schema must be documented for future maintainers.,0,1,0,0,0,0,1,0,0,0,0,0,0,0,exchange portal database schema must documented future maintainer,0,0.014698278532057196,0,0
SYN-351,Student portal must provide voice search for course catalogs.,0,1,0,0,0,0,0,1,0,0,0,0,0,0,student portal must provide voice search course catalog,0,0.005181536071364001,0,0
SYN-352,Carpooling ETA predictions must update within 300ms of traffic change.,0,1,0,0,0,0,0,0,1,0,0,0,0,0,carpooling eta prediction must update within NUM m traffic change,0,0.009383232690284697,0,0
SYN-353,Delivery app must render correctly on 10-inch tablets with 1280x800 resolution.,0,1,0,0,0,0,0,0,0,1,0,0,0,0,delivery app must render correctly NUM inch tablet NUM x NUM resolution,0,0.041014110265685515,0,0
SYN-354,University portal must auto-provision container instances for 5000 new users.,0,1,0,0,0,0,0,0,0,0,1,0,0,0,university portal must autoprovision container instance NUM new user,0,0.04093091112308945,0,0
SYN-355,Carpooling payment tokens must expire after 15 minutes of inactivity.,0,1,0,0,0,0,0,0,0,0,0,1,0,0,carpooling payment token must expire NUM minute inactivity,0,0.005415295917229975,0,0
SYN-356,Restaurant tablet order history must be filterable by date and meal type.,0,1,0,0,0,0,0,0,0,0,0,0,1,0,restaurant tablet order history must filterable date meal type,0,0.045383647264185485,0,0
SYN-357,Islamabad carpooling must provide 99.999% availability for emergency ride requests.,0,1,1,0,0,0,0,0,0,0,0,0,0,0,islamabad carpooling must provide NUM availability emergency ride request,0,0.003534717872479114,0,0
SYN-358,Delivery system must sync order data after network restoration without duplicates.,0,1,0,1,0,0,0,0,0,0,0,0,0,0,delivery system must sync order data network restoration without duplicate,0,0.002679773217184839,0,0
SYN-359,Carpooling app must display driver background verification as per Islamabad law.,0,1,0,0,1,0,0,0,0,0,0,0,0,0,carpooling app must display driver background verification per islamabad law,0,0.005755050060582879,0,0
SYN-360,Restaurant must use flat design principles for tablet menu cards.,0,1,0,0,0,1,0,0,0,0,0,0,0,0,restaurant must use flat design principle tablet menu card,0,0.008332350999940834,0,0
SYN-361,Exchange portal must have automated rollback on deployment failure.,0,1,0,0,0,0,1,0,0,0,0,0,0,0,exchange portal must automated rollback deployment failure,0,0.016151768379250316,0,0
SYN-362,Student portal must remember login session across tablet browser tabs.,0,1,0,0,0,0,0,1,0,0,0,0,0,0,student portal must remember login session across tablet browser tab,0,0.018713920678468082,0,0
SYN-363,Carpooling matchmaking must process 2500 requests per second with 200ms latency.,0,1,0,0,0,0,0,0,1,0,0,0,0,0,carpooling matchmaking must process NUM request per second NUM m latency,0,0.0056868215084926125,0,0
SYN-364,Delivery app must run on 10-inch tablets with Android 11 and 12.,0,1,0,0,0,0,0,0,0,1,0,0,0,0,delivery app must run NUM inch tablet android NUM NUM,0,0.012203224320549537,0,0
SYN-365,University portal must scale database connections from 50 to 5000 elastically.,0,1,0,0,0,0,0,0,0,0,1,0,0,0,university portal must scale database connection NUM NUM elastically,0,0.0022365801392768355,0,0
SYN-366,Carpooling rider location must be anonymized with differential privacy.,0,1,0,0,0,0,0,0,0,0,0,1,0,0,carpooling rider location must anonymized differential privacy,0,0.04038719863138027,0,0
SYN-367,Restaurant tablet must provide haptic feedback for order confirmation button.,0,1,0,0,0,0,0,0,0,0,0,0,1,0,restaurant tablet must provide haptic feedback order confirmation button,0,0.01360666542734348,0,0
SYN-368,Islamabad carpooling must have no single point of failure in ride dispatch.,0,1,1,0,0,0,0,0,0,0,0,0,0,0,islamabad carpooling must single point failure ride dispatch,0,0.04774230273039568,0,0
SYN-369,Delivery system must implement saga pattern for distributed order transactions.,0,1,0,1,0,0,0,0,0,0,0,0,0,0,delivery system must implement saga pattern distributed order transaction,0,0.00786040590351308,0,0
SYN-370,Carpooling platform must retain trip data for insurance claims as per local law.,0,1,0,0,1,0,0,0,0,0,0,0,0,0,carpooling platform must retain trip data insurance claim per local law,0,0.013398383679759105,0,0
SYN-371,Restaurant app must use minimalist iconography for faster user recognition.,0,1,0,0,0,1,0,0,0,0,0,0,0,0,restaurant app must use minimalist iconography faster user recognition,0,0.0075435275348822925,0,0
SYN-372,Exchange portal’s configuration must be externalized for environment switching.,0,1,0,0,0,0,1,0,0,0,0,0,0,0,exchange portal configuration must externalized environment switching,0,0.04215731113531867,0,0
SYN-373,Student portal must support pinch-to-zoom on course schedule calendar.,0,1,0,0,0,0,0,1,0,0,0,0,0,0,student portal must support pinchtozoom course schedule calendar,0,0.007100630039219227,0,0
SYN-374,Carpooling price surge algorithm must run in under 400ms.,0,1,0,0,0,0,0,0,1,0,0,0,0,0,carpooling price surge algorithm must run NUM m,0,0.03612157221368038,0,0
SYN-375,Delivery tablet app must be installable on 10-inch Lenovo Tab P11.,0,1,0,0,0,0,0,0,0,1,0,0,0,0,delivery tablet app must installable NUM inch lenovo tab p NUM,0,0.019411606363892282,0,0
SYN-377,Carpooling driver app must use certificate pinning to prevent MITM attacks.,0,1,0,0,0,0,0,0,0,0,0,1,0,0,carpooling driver app must use certificate pinning prevent mitm attack,0,0.004189983638936245,0,0
SYN-378,Restaurant tablet must allow one-click reorder from past purchases.,0,1,0,0,0,0,0,0,0,0,0,0,1,0,restaurant tablet must allow oneclick reorder past purchase,0,0.03236952709112792,0,0
SYN-379,Islamabad carpooling must have 99.9% availability during national holidays.,0,1,1,0,0,0,0,0,0,0,0,0,0,0,islamabad carpooling must NUM availability national holiday,0,0.002598863336819118,0,0
SYN-380,Delivery system must survive tablet database corruption via graceful degradation.,0,1,0,1,0,0,0,0,0,0,0,0,0,0,delivery system must survive tablet database corruption via graceful degradation,0,0.009286717122685837,0,0
SYN-381,Carpooling app must follow Islamabad consumer protection e-transport rules.,0,1,0,0,1,0,0,0,0,0,0,0,0,0,carpooling app must follow islamabad consumer protection etransport rule,0,0.03317280916988132,0,0
SYN-382,Restaurant dashboard must use consistent card-based layout for menu items.,0,1,0,0,0,1,0,0,0,0,0,0,0,0,restaurant dashboard must use consistent cardbased layout menu item,0,0.028540501740709937,0,0
SYN-383,Exchange portal must have canary deployments for risk-free updates.,0,1,0,0,0,0,1,0,0,0,0,0,0,0,exchange portal must canary deployment riskfree update,0,0.018006852156720998,0,0
SYN-384,Student portal must provide auto-save for application form every 30 seconds.,0,1,0,0,0,0,0,1,0,0,0,0,0,0,student portal must provide autosave application form every NUM second,0,0.009347641460684095,0,0
SYN-385,Carpooling driver assignment must complete within 600ms for 300 concurrent users.,0,1,0,0,0,0,0,0,1,0,0,0,0,0,carpooling driver assignment must complete within NUM m NUM concurrent user,0,0.009747670416290344,0,0
SYN-386,Delivery app must run on 10-inch tablets with 2GB RAM efficiently.,0,1,0,0,0,0,0,0,0,1,0,0,0,0,delivery app must run NUM inch tablet NUM gb ram efficiently,0,0.015336112223427213,0,0
SYN-388,Carpooling ride history must be encrypted at rest using AES-256.,0,1,0,0,0,0,0,0,0,0,0,1,0,0,carpooling ride history must encrypted rest using aes NUM,0,0.022421106796207724,0,0
SYN-389,Restaurant tablet must show confirmation snackbar after each order addition.,0,1,0,0,0,0,0,0,0,0,0,0,1,0,restaurant tablet must show confirmation snackbar order addition,0,0.011844821259376942,0,0
SYN-390,Islamabad carpooling must have automatic failover within 10 seconds for ride state.,0,1,1,0,0,0,0,0,0,0,0,0,0,0,islamabad carpooling must automatic failover within NUM second ride state,0,0.004670914896862678,0,0
SYN-391,Delivery system must re-queue failed order submissions with idempotency keys.,0,1,0,1,0,0,0,0,0,0,0,0,0,0,delivery system must requeue failed order submission idempotency key,0,0.004619578426398732,0,0
SYN-392,Carpooling app must display government-mandated fare breakdown per kilometer.,0,1,0,0,1,0,0,0,0,0,0,0,0,0,carpooling app must display governmentmandated fare breakdown per kilometer,0,0.016803186915980206,0,0
SYN-393,Restaurant app must use blurred background effects for modal dialogs.,0,1,0,0,0,1,0,0,0,0,0,0,0,0,restaurant app must use blurred background effect modal dialog,0,0.012968585469945074,0,0
SYN-394,Exchange portal must have automated performance regression tests in CI/CD.,0,1,0,0,0,0,1,0,0,0,0,0,0,0,exchange portal must automated performance regression test cicd,0,0.025146036291989034,0,0
SYN-395,Student portal must provide multi-language support for Urdu and English.,0,1,0,0,0,0,0,1,0,0,0,0,0,0,student portal must provide multilanguage support urdu english,0,0.007292363726152214,0,0
SYN-396,Carpooling real-time traffic integration must refresh every 2 seconds.,0,1,0,0,0,0,0,0,1,0,0,0,0,0,carpooling realtime traffic integration must refresh every NUM second,0,0.06675538597542545,0,0
SYN-397,Delivery app must support 10-inch tablets from Xiaomi and Realme brands.,0,1,0,0,0,0,0,0,0,1,0,0,0,0,delivery app must support NUM inch tablet xiaomi realme brand,0,0.004430437640581976,0,0
SYN-398,University portal must auto-scale storage for 10TB of student documents.,0,1,0,0,0,0,0,0,0,0,1,0,0,0,university portal must autoscale storage NUM tb student document,0,0.010954212240823578,0,0
SYN-399,Carpooling emergency contact sharing must use authenticated encryption.,0,1,0,0,0,0,0,0,0,0,0,1,0,0,carpooling emergency contact sharing must use authenticated encryption,0,0.02234052808154906,0,0
SYN-400,Islamabad carpooling must maintain 99.99% uptime during heavy fog season.,0,1,1,0,0,0,0,0,0,0,0,0,0,0,islamabad carpooling must maintain NUM uptime heavy fog season,0,0.01664458384741274,0,0
SYN-401,Restaurant delivery tablet must queue offline orders and sync automatically.,0,1,0,1,0,0,0,0,0,0,0,0,0,0,restaurant delivery tablet must queue offline order sync automatically,0,0.012177960018115481,0,0
SYN-402,Student exchange portal must comply with Islamabad cross-border student data transfer laws.,0,1,0,0,1,0,0,0,0,0,0,0,0,0,student exchange portal must comply islamabad crossborder student data transfer law,0,0.008828972125921089,0,0
SYN-403,Carpooling app must use Islamabad road sign colors for route highlights.,0,1,0,0,0,1,0,0,0,0,0,0,0,0,carpooling app must use islamabad road sign color route highlight,0,0.004985471850193094,0,0
SYN-404,Delivery platform’s restaurant management module must be pluggable without core changes.,0,1,0,0,0,0,1,0,0,0,0,0,0,0,delivery platform restaurant management module must pluggable without core change,0,0.020795515568232514,0,0
SYN-405,University portal must provide single sign-on for all student services.,0,1,0,0,0,0,0,1,0,0,0,0,0,0,university portal must provide single signon student service,0,0.006026147505677917,0,0
SYN-406,Carpooling notification push must reach 1000 devices within 1 second.,0,1,0,0,0,0,0,0,1,0,0,0,0,0,carpooling notification push must reach NUM device within NUM second,0,0.002283215112066782,0,0
SYN-407,Restaurant tablet app must function on 10-inch Fire HD and Galaxy Tab.,0,1,0,0,0,0,0,0,0,1,0,0,0,0,restaurant tablet app must function NUM inch fire hd galaxy tab,0,0.025508640844749773,0,0
SYN-408,Islamabad carpooling must support 10000 daily active users with elastic resources.,0,1,0,0,0,0,0,0,0,0,1,0,0,0,islamabad carpooling must support NUM daily active user elastic resource,0,0.0032294241624800544,0,0
SYN-409,Delivery system must prevent replay attacks on order submission endpoints.,0,1,0,0,0,0,0,0,0,0,0,1,0,0,delivery system must prevent replay attack order submission endpoint,0,0.02750009897922455,0,0
SYN-410,Student portal must have intuitive progress bar for semester registration steps.,0,1,0,0,0,0,0,0,0,0,0,0,1,0,student portal must intuitive progress bar semester registration step,0,0.02883923766812815,0,0
SYN-411,Carpooling must provide 99.95% availability for trip matching service.,0,1,1,0,0,0,0,0,0,0,0,0,0,0,carpooling must provide NUM availability trip matching service,0,0.005106406691942946,0,0
SYN-412,Restaurant system must cache order data locally for 24 hours offline.,0,1,0,1,0,0,0,0,0,0,0,0,0,0,restaurant system must cache order data locally NUM hour offline,0,0.0033621807353285283,0,0
SYN-413,Exchange portal must retain audit logs for 7 years per higher education commission rules.,0,1,0,0,1,0,0,0,0,0,0,0,0,0,exchange portal must retain audit log NUM year per higher education commission rule,0,0.03008954973764888,0,0
SYN-414,Carpooling must use smooth transitions between ride selection and payment screens.,0,1,0,0,0,1,0,0,0,0,0,0,0,0,carpooling must use smooth transition ride selection payment screen,0,0.005088988254196149,0,0
