ProjectID,RequirementText,IsFunctional,IsQuality,Availability (A),Fault Tolerance (FT),Legal (L),Look & Feel (LF),Maintainability (MN),Operability (O),Performance (PE),Portability (PO),Scalability (SC),Security (SE),Usability (US),Other (OT),CleanedRequirementText
8,'The website shall make its user aware of its information practices before collection data from them via a Privacy Policy accessible on all pages of the website.',1,1,0,0,0,0,0,0,0,0,0,1,1,0,website shall make user aware information practice collection data via privacy policy accessible page website
8,'The system shall notify customers of changes to its information policy.',1,0,0,0,0,0,0,0,0,0,0,0,0,0,system shall notify customer change information policy
8,The system shall reveal private information only in compliance with the organization's information policy.',0,1,0,0,1,0,0,0,0,0,0,1,0,0,system shall reveal private information compliance organization information policy
8,'All customer information will be stored on a secure database accessible only to authorized personnel.',0,1,0,0,0,0,0,0,0,0,0,1,0,0,customer information stored secure database accessible authorized personnel
8,'All credit card information will be encrypted in the database.',0,1,0,0,0,0,0,0,0,0,0,1,0,0,credit card information encrypted database
8,'The streaming server will have anti-virus software to prevent infection of malicious viruses.',0,1,0,0,0,0,0,0,0,0,0,1,0,0,streaming server antivirus software prevent infection malicious virus
8,'The website should cater to all tribes in Nigeria.',0,1,0,0,0,1,0,0,0,0,0,0,1,0,website cater tribe nigeria
8,'The website shall not be offensive to religious or ethnic groups.',0,1,0,0,0,1,0,0,0,0,0,0,0,0,website shall offensive religious ethnic group
8,'The website should appeal to all Africans not only Nigerians.',0,1,0,0,0,1,0,0,0,0,0,0,0,0,website appeal african nigerian
8,'The website should use Flash to provide animation on the home page.',0,1,0,0,0,1,0,1,0,0,0,0,0,0,website use flash provide animation home page
8,'IzognMovies shall meet the licensing requirements set forth by the appropriate organizations in order to stream African movies.',0,1,0,0,1,0,0,0,0,0,0,0,0,0,izognmovies shall meet licensing requirement set forth appropriate organization order stream african movie
8,'The website will comply with W3C standards.',0,1,0,0,1,0,0,0,0,0,0,1,0,0,website comply w NUM c standard
8,'The PHP code will comply with PEAR standards.',0,1,0,0,1,0,0,0,0,0,0,1,0,0,php code comply pear standard
8,'The website will allow customers to search for movies by title actor or director.',1,0,0,0,0,0,0,0,0,0,0,0,0,0,website allow customer search movie title actor director
8,'viewing a movie details the website will display the movies description actor and director entered in by the administrator.',1,0,0,0,0,0,0,0,0,0,0,0,0,0,viewing movie detail website display movie description actor director entered administrator
8,'Website shall request and authorize credit card payment before allowing a user to stream a movie.',1,0,0,0,0,0,0,0,0,0,0,0,0,0,website shall request authorize credit card payment allowing user stream movie
8,'shall be able to stream purchased movie via Windows Media Player for up to 2 days aftere purchase date.',1,0,0,0,0,0,0,0,0,0,0,0,0,0,shall able stream purchased movie via window medium player NUM day aftere purchase date
8,'Website shall allow customers to browse movies by categories entered in by izogn administrator.',1,0,0,0,0,0,0,0,0,0,0,0,0,0,website shall allow customer browse movie category entered izogn administrator
8,'Website shall allow customers to view reviews of selected movies by other customers.',1,0,0,0,0,0,0,0,0,0,0,0,0,0,website shall allow customer view review selected movie customer
8,'Website shall allow customers to add their own movie review for a selected movie.',1,0,0,0,0,0,0,0,0,0,0,0,0,0,website shall allow customer add movie review selected movie
8,'Website shall allow the Izogn administrator to approve a review posted by a customer.',1,0,0,0,0,0,0,0,0,0,0,0,0,0,website shall allow izogn administrator approve review posted customer
8,'System will allow customers to pay for a streaming movie with a pre-paid card.',1,0,0,0,0,0,0,0,0,0,0,0,0,0,system allow customer pay streaming movie prepaid card
8,'Website shall allow customers to purchase pre-paid cards of $5 $10 or $20 value either by credit card or mail-in payment option.',1,0,0,0,0,0,0,0,0,0,0,0,0,0,website shall allow customer purchase prepaid card NUM NUM NUM value either credit card mailin payment option
8,'System shall automatically update the main page of the website every Friday and show the 4 latest movies that have been added to the website.',1,0,0,0,0,0,0,0,0,0,0,0,0,0,system shall automatically update main page website every friday show NUM latest movie added website
8,'System shall allow users to update their billing and contact information via the â€œMy Accountâ€ section of the website.',1,0,0,0,0,0,0,0,0,0,0,0,0,0,system shall allow user update billing contact information via âœmy accountâ section website
8,'Pre-paid cards shall be distributed via email or via a printed paper card.',1,0,0,0,0,0,0,0,0,0,0,0,0,0,prepaid card shall distributed via email via printed paper card
8,'Movies can only be streamed if the customer has purchased a movie and is within the 2-day time period to stream the movie.',1,0,0,0,0,0,0,0,0,0,0,0,0,0,movie streamed customer purchased movie within NUM day time period stream movie
8,'Website must be able to support free trial periods with various parameters set by the Izogn Manager.',1,0,0,0,0,0,0,0,0,0,0,0,0,0,website must able support free trial period various parameter set izogn manager
8,'All streaming movie sales will be logged in the database and accessible by the administrator.',1,1,1,0,0,0,0,0,0,0,0,0,0,0,streaming movie sale logged database accessible administrator
8,'All registered customer information shall be stored and maintained in the database even after the customer cancels their account.',1,0,0,0,0,0,0,0,0,0,0,0,0,0,registered customer information shall stored maintained database even customer cancel account
8,'Daily usage statistics should be logged and accessible by the administrator.',1,1,0,0,0,0,1,0,0,0,0,0,0,0,daily usage statistic logged accessible administrator
8,'The owner shall have free access to all of the streaming movies.',0,1,1,0,0,0,0,0,0,0,0,1,1,0,owner shall free access streaming movie
9,'Total lead cycle time must be completed in 5 minutes for 90% of lead volume between the business hours of 8AM CST to 8PM CST; then 3 minutes for 99% of lead volume during off business hours.',0,1,1,0,0,0,0,0,1,0,0,0,0,0,total lead cycle time must completed NUM minute NUM lead volume business hour NUM am cst NUM pm cst NUM minute NUM lead volume business hour
9,'No lead evaluation will complete in a time period longer than 25 seconds for 97% of all leads processed.',0,1,1,0,0,0,0,0,1,0,0,0,0,0,lead evaluation complete time period longer NUM second NUM lead processed
9,'For leads that process longer than 25 seconds the system will record the event and duration',1,0,0,0,0,0,0,0,0,0,0,0,0,0,lead process longer NUM second system record event duration
9,'The process must fit within the processing time conditions set forth by the Auto Rep Assignment process in which a lead is assigned within 3 minutes of the total life cycle.',0,1,0,0,0,0,0,0,1,0,0,0,0,0,process must fit within processing time condition set forth auto rep assignment process lead assigned within NUM minute total life cycle
9,'The lead washing process will operate within the established physical web service structure.',0,1,0,0,0,0,0,1,0,0,0,0,0,0,lead washing process operate within established physical web service structure
9,'The washing process must use a non binding neutral data format such as xml when receiving and processing lead data.',0,1,0,0,0,0,0,1,0,0,0,0,0,0,washing process must use non binding neutral data format xml receiving processing lead data
9,'Defect reports will be available to technical units on a 24x7 basis.',0,1,1,1,0,0,0,0,0,0,0,0,0,0,defect report available technical unit NUM x NUM basis
9,'Washing parameters will be updated during scheduled maintenance hours.',0,1,0,0,0,0,1,0,0,0,0,0,0,0,washing parameter updated scheduled maintenance hour
9,'The vendor will verify the invalid lead.',1,0,0,0,0,0,0,0,0,0,0,0,0,0,vendor verify invalid lead
9,'Vendor will submit a credit validation record to be applied to the enterprise billing system.',1,0,0,0,0,0,0,0,0,0,0,0,0,0,vendor submit credit validation record applied enterprise billing system
9,'If a lead is scored to the high range the system will supply the lead data and score to the enterprise system.',1,0,0,0,0,0,0,0,0,0,0,0,0,0,lead scored high range system supply lead data score enterprise system
9,'The leads washing functionality will validate all leads received by the web service for valid data',1,0,0,0,0,0,0,0,0,0,0,0,0,0,lead washing functionality validate lead received web service valid data
9,'The leads washing functionality will insert all leads captured by the web service.',1,0,0,0,0,0,0,0,0,0,0,0,0,0,lead washing functionality insert lead captured web service
9,'If the leads score falls within the high average score then it will be process by the ARA functionality.',1,0,0,0,0,0,0,0,0,0,0,0,0,0,lead score fall within high average score process ara functionality
9,'If the leads score falls within the medium average then it will be set for manual verification by an Enrollment Coordinator through the eleads system.',1,0,0,0,0,0,0,0,0,0,0,0,0,0,lead score fall within medium average set manual verification enrollment coordinator eleads system
9,'If the leads score falls within the low average then it will be returned to the supplying vendor',1,0,0,0,0,0,0,0,0,0,0,0,0,0,lead score fall within low average returned supplying vendor
9,'The leads washing functionality will compile both contact and academic scoring information for a total score.',1,0,0,0,0,0,0,0,0,0,0,0,0,0,lead washing functionality compile contact academic scoring information total score
9,'The leads washing functionality will use the parameters supplied by corporate and schools to score part of the lead.',1,0,0,0,0,0,0,0,0,0,0,0,0,0,lead washing functionality use parameter supplied corporate school score part lead
9,'The leads washing functionality will return the lead data supplied to the vendor along with the reason of rejection.',1,0,0,0,0,0,0,0,0,0,0,0,0,0,lead washing functionality return lead data supplied vendor along reason rejection
9,'The leads washing functionality will have an interface in which lead data parameters can be maintained.',1,0,0,0,0,0,0,0,0,0,0,0,0,0,lead washing functionality interface lead data parameter maintained
9,'The leads washing functionality will verify the users authentication and rights to make parameter updates.',1,0,0,0,0,0,0,0,0,0,0,0,0,0,lead washing functionality verify user authentication right make parameter update
9,'The leads washing functionality will store any potential lead duplicates returned by the enterprise system.',1,0,0,0,0,0,0,0,0,0,0,0,0,0,lead washing functionality store potential lead duplicate returned enterprise system
9,'Prior to submitting the lead to the enterprise system the leads washing functionality will assign the lead to an admissions rep.',1,0,0,0,0,0,0,0,0,0,0,0,0,0,prior submitting lead enterprise system lead washing functionality assign lead admission rep
9,'The leads washing functionality shall receive a period list of available reps from the enterprise system.',1,0,0,0,0,0,0,0,0,0,0,0,0,0,lead washing functionality shall receive period list available rep enterprise system
10,'The product shall simulate the look of ships at sea.',0,1,0,0,0,1,0,0,0,0,0,0,0,0,product shall simulate look ship sea
10,'The product shall display the grids within a circle as a view from a periscope.',0,1,0,0,0,1,0,0,0,0,0,0,0,0,product shall display grid within circle view periscope
10,'The product shall display each type of ship in a grid using an image of the specific type of ship.',0,1,0,0,0,1,0,0,0,0,0,0,0,0,product shall display type ship grid using image specific type ship
10,'When the offensive player takes a shot the product shall simulate the sound of a ship at sea.',1,1,0,0,0,1,0,0,0,0,0,0,0,0,offensive player take shot product shall simulate sound ship sea
10,'When a shot is marked as a miss the product shall simulate the sound of a shot missing its target.',1,1,0,0,0,1,0,0,0,0,0,0,0,0,shot marked miss product shall simulate sound shot missing target
10,'When a shot is marked as a hit the product shall simulate the sound of a shot hitting its target.',1,1,0,0,0,1,0,0,0,0,0,0,0,0,shot marked hit product shall simulate sound shot hitting target
10,'When a ship is sunk the product shall simulate the sound of a sinking ship.',1,1,0,0,0,1,0,0,0,0,0,0,0,0,ship sunk product shall simulate sound sinking ship
10,'The product shall be available 24 hours per day seven days per week.',0,1,1,0,0,0,0,0,0,0,0,0,0,0,product shall available NUM hour per day seven day per week
10,'The product shall able to handle a large number of games simultaneously.',0,1,0,0,0,0,0,0,1,0,1,0,0,0,product shall able handle large number game simultaneously
10,'The response time shall be fast enough to maintain the flow of the game. The response time shall be no more than 2 seconds for 95% of responses and no more than 4% for the remaining responses.',0,1,0,0,0,0,0,0,1,0,0,0,0,0,response time shall fast enough maintain flow game response time shall NUM second NUM response NUM remaining response
10,'The product shall protect the identity of the players. The product shall provide players no access to information that might reveal the identity of another player.',0,1,0,0,0,0,0,0,0,0,0,1,0,0,product shall protect identity player product shall provide player access information might reveal identity another player
10,'The product shall be intuitive and self-explanatory. Nine out ten users shall be able to successfully complete a game with no training.',0,1,0,0,0,0,0,0,0,0,0,0,1,0,product shall intuitive selfexplanatory nine ten user shall able successfully complete game training
10,'The product shall be available to players who understand English Spanish and French. The product shall allow the user to select the language upon accessing the product.',1,1,0,0,0,0,0,0,0,0,0,0,1,0,product shall available player understand english spanish french product shall allow user select language upon accessing product
10,'The product shall provide players no access to information that might reveal the identity of another player',0,1,0,0,0,0,0,0,0,0,0,1,0,0,product shall provide player access information might reveal identity another player
10,'The product shall maintain a list of players.',1,0,0,0,0,0,0,0,0,0,0,0,0,0,product shall maintain list player
10,'The product shall allow a user to identify himself or herself as a player.',1,0,0,0,0,0,0,0,0,0,0,0,0,0,product shall allow user identify player
10,'Once a game has been initiated the product shall make the players assigned to the game unavailable for selection from the list of players.',1,0,0,0,0,0,0,0,0,0,0,0,0,0,game initiated product shall make player assigned game unavailable selection list player
10,'The product shall allow a user to remove himself or herself from the list of players at any time.',1,0,0,0,0,0,0,0,0,0,0,0,0,0,product shall allow user remove list player time
10,'The product shall make inactive players unavailable for selection from the list of players.',1,0,0,0,0,0,0,0,0,0,0,0,0,0,product shall make inactive player unavailable selection list player
10,'The product shall remove players who have been inactive for 24 hours from the list of players.',1,0,0,0,0,0,0,0,0,0,0,0,0,0,product shall remove player inactive NUM hour list player
10,'The product shall allow a player to initiate a game by selecting another available player from the list of players.',1,0,0,0,0,0,0,0,0,0,0,0,0,0,product shall allow player initiate game selecting another available player list player
10,'Once a game is initiated the product shall display a defensive grid to each player',1,0,0,0,0,0,0,0,0,0,0,0,0,0,game initiated product shall display defensive grid player
10,'Once a game is initiated the product shall display an offensive grid to each player.',1,0,0,0,0,0,0,0,0,0,0,0,0,0,game initiated product shall display offensive grid player
10,'The product shall prevent a player from viewing the offensive or defensive grids of the other player.',1,0,0,0,0,0,0,0,0,0,0,0,0,0,product shall prevent player viewing offensive defensive grid player
10,'Once a game is initiated the product shall allow each player to position their 5 ships on their respective defensive grids.',1,0,0,0,0,0,0,0,0,0,0,0,0,0,game initiated product shall allow player position NUM ship respective defensive grid
10,'The product shall allow a player to position ships horizontally on their grid.',1,0,0,0,0,0,0,0,0,0,0,0,0,0,product shall allow player position ship horizontally grid
10,'The product shall allow the player to position ships vertically on their grid.',1,0,0,0,0,0,0,0,0,0,0,0,0,0,product shall allow player position ship vertically grid
10,'The product shall allow the player to position ships diagonally on their grid',1,0,0,0,0,0,0,0,0,0,0,0,0,0,product shall allow player position ship diagonally grid
10,'The product shall prevent the player from overlapping ships on their grid.',1,0,0,0,0,0,0,0,0,0,0,0,0,0,product shall prevent player overlapping ship grid
10,'When both players have positioned their 5 ships on their defensive grids the product shall define the status of each player for the first turn.',1,0,0,0,0,0,0,0,0,0,0,0,0,0,player positioned NUM ship defensive grid product shall define status player first turn
10,'For each turn the product shall identify one player as offensive status and one player as defensive status.',1,0,0,0,0,0,0,0,0,0,0,0,0,0,turn product shall identify one player offensive status one player defensive status
10,'The product shall maintain the status of each player for a turn either offensive or defensive.',1,0,0,0,0,0,0,0,0,0,0,0,0,0,product shall maintain status player turn either offensive defensive
10,'At the start of each turn the product shall notify each player of his or her status.',1,0,0,0,0,0,0,0,0,0,0,0,0,0,start turn product shall notify player status
10,'For each turn the product shall allow the offensive player to define a shot.',1,0,0,0,0,0,0,0,0,0,0,0,0,0,turn product shall allow offensive player define shot
10,'For each shot the product shall examine the defensive grid of the defensive player to determine whether the shot was a hit or miss.',1,0,0,0,0,0,0,0,0,0,0,0,0,0,shot product shall examine defensive grid defensive player determine whether shot hit miss
10,'For each shot the product shall notify the players whether the shot was a hit or miss.',1,0,0,0,0,0,0,0,0,0,0,0,0,0,shot product shall notify player whether shot hit miss
10,'For each shot the product shall mark the shot as a hit or miss on the defensive grid of the defensive player.',1,0,0,0,0,0,0,0,0,0,0,0,0,0,shot product shall mark shot hit miss defensive grid defensive player
10,'For each shot the product shall mark the shot as a hit or miss on the offensive grid of the offensive player.',1,0,0,0,0,0,0,0,0,0,0,0,0,0,shot product shall mark shot hit miss offensive grid offensive player
10,'When the hit results in sinking a ship the product shall notify the players that the ship was sunk.',1,0,0,0,0,0,0,0,0,0,0,0,0,0,hit result sinking ship product shall notify player ship sunk
10,'When the hit results in sinking a ship the product shall mark the ship as sunk on the defensive grid of the defensive player.',1,0,0,0,0,0,0,0,0,0,0,0,0,0,hit result sinking ship product shall mark ship sunk defensive grid defensive player
10,'When the hit results in sinking a ship the product shall indicate the type of ship sunk on the defensive grid of the defensive player.',1,0,0,0,0,0,0,0,0,0,0,0,0,0,hit result sinking ship product shall indicate type ship sunk defensive grid defensive player
10,'When the hit results in sinking a ship the product shall mark the ship as sunk on the offensive grid of the offensive player.',1,0,0,0,0,0,0,0,0,0,0,0,0,0,hit result sinking ship product shall mark ship sunk offensive grid offensive player
10,'If the shot was marked as a hit the product shall allow the offensive player to define a shot.',1,0,0,0,0,0,0,0,0,0,0,0,0,0,shot marked hit product shall allow offensive player define shot
10,'If the shot was marked as a miss the product shall change the status of the offensive player to defensive',1,0,0,0,0,0,0,0,0,0,0,0,0,0,shot marked miss product shall change status offensive player defensive
10,'If the shot was marked as a miss the product shall change the status of the defensive player to offensive',1,0,0,0,0,0,0,0,0,0,0,0,0,0,shot marked miss product shall change status defensive player offensive
10,'The product shall continue to assign turns until the game is ended.',1,0,0,0,0,0,0,0,0,0,0,0,0,0,product shall continue assign turn game ended
10,The product shall end a game when a hit by the offensive player results in sinking the last of the defensive player's ships which had not been previously marked as sunk.',1,0,0,0,0,0,0,0,0,0,0,0,0,0,product shall end game hit offensive player result sinking last defensive player ship previously marked sunk
10,'The product shall allow a player to end a game at any time during the game.',1,0,0,0,0,0,0,0,0,0,0,0,0,0,product shall allow player end game time game
10,'When a game is ended the product shall notify the players that the game is ended.',1,0,0,0,0,0,0,0,0,0,0,0,0,0,game ended product shall notify player game ended
10,'The notification of the game ending will include the reason the game is ended (i.e. a player has won the game or a player has ended the game).',1,0,0,0,0,0,0,0,0,0,0,0,0,0,notification game ending include reason game ended ie player game player ended game
10,'When a game is ended the product shall allow each player to identify himself or herself as an available player in the list of players.',1,0,0,0,0,0,0,0,0,0,0,0,0,0,game ended product shall allow player identify available player list player
10,'When a game is ended the product shall allow each player to remove himself or herself from the list of players.',1,0,0,0,0,0,0,0,0,0,0,0,0,0,game ended product shall allow player remove list player
11,The system shall be easy to use by callers and supervisors. Callers and supervisors must be able to accomplish any system task within 2 minutes.',0,1,0,0,0,0,0,0,1,0,0,0,1,0,system shall easy use caller supervisor caller supervisor must able accomplish system task within NUM minute
11,The system shall be easy to learn by callers and supervisors. Callers and supervisors shall learn how to use the system within 10 minutes.',0,1,0,0,0,0,0,0,0,0,0,0,1,0,system shall easy learn caller supervisor caller supervisor shall learn use system within NUM minute
11,The system shall be responsive. At the DePaul TeleServices Center when a supervisor uses the system to view a callers schedule the system response time must be no more than 2 seconds 90% of the time and no more than 5 seconds the rest of the time.',0,1,0,0,0,0,0,0,1,0,0,0,1,0,system shall responsive depaul teleservices center supervisor us system view caller schedule system response time must NUM second NUM time NUM second rest time
11,On a 56k connection the system response time for all operations must be no more than 6 seconds 90% of the time.',0,1,1,0,0,0,0,0,1,0,0,0,0,0,NUM k connection system response time operation must NUM second NUM time
11,On a 112k connection or faster the system response time for all operations must be no more than 3 seconds 90% of the time.',0,1,1,0,0,0,0,0,1,0,0,0,0,0,NUM k connection faster system response time operation must NUM second NUM time
11,The system shall have high availability every day of the year.The system must be available for use between 12:00AM and 6:00PM all days of the year.',0,1,1,0,0,0,0,0,0,0,0,0,0,0,system shall high availability every day yearthe system must available use NUM am NUM pm day year
11,The system must be available for use between 7:00AM and 11:59PM all days of the year.',0,1,1,0,0,0,0,0,0,0,0,0,0,0,system must available use NUM am NUM pm day year
11,The product shall be internet browser independent.The product must run using Internet Explorer and Netscape Navigator.',0,1,0,0,0,0,0,0,0,1,0,0,0,0,product shall internet browser independentthe product must run using internet explorer netscape navigator
11,The product shall ensure that only supervisors can advertise empty time slots.The product must ensure that supervisors are allowed to access advertise empty time slots.',1,1,0,0,0,0,0,0,0,0,0,1,0,0,product shall ensure supervisor advertise empty time slotsthe product must ensure supervisor allowed access advertise empty time slot
11,The product shall ensure that only supervisors can enter a caller's schedule.The product must ensure that supervisors are allowed to access advertise empty time slots.',1,1,0,0,0,0,0,0,0,0,0,1,0,0,product shall ensure supervisor enter caller schedulethe product must ensure supervisor allowed access advertise empty time slot
11,The product shall ensure that only supervisors can view schedule of all callers.The product must ensure that supervisors are allowed to access advertise empty time slots.',1,1,0,0,0,0,0,0,0,0,0,1,0,0,product shall ensure supervisor view schedule callersthe product must ensure supervisor allowed access advertise empty time slot
11,The interface shall have a simple look. In the interface and usability survey 90% of beta testers must report that the interface is adequately simple.',0,1,0,0,0,1,0,0,0,0,0,0,0,0,interface shall simple look interface usability survey NUM beta tester must report interface adequately simple
