ProjectID,RequirementText,IsFunctional,IsQuality,Availability (A),Fault Tolerance (FT),Legal (L),Look & Feel (LF),Maintainability (MN),Operability (O),Performance (PE),Portability (PO),Scalability (SC),Security (SE),Usability (US),Other (OT),CleanedRequirementText
3,'Program Administrators/Nursing Staff Members shall be able to cancel a clinical lab section only if there are no students registered for that clinical lab section.',1,0,0,0,0,0,0,0,0,0,0,0,0,0,program administratorsnursing staff member shall able cancel clinical lab section student registered clinical lab section
3,'A Program Administrator/Nursing Staff Member shall be able to add a new nursing student to the system.',1,0,0,0,0,0,0,0,0,0,0,0,0,0,program administratornursing staff member shall able add new nursing student system
3,'A staff member shall have the ability to manage the progress of a part time student which includes modifying their sequence of classes and timeline of classes.',1,0,0,0,0,0,0,0,0,0,0,0,0,0,staff member shall ability manage progress part time student includes modifying sequence class timeline class
3,'The system shall be able to display a printable summary for individual cohorts which will include the students enlisted the Program of study sequence of classes cohort progress through the program and timeline of completion.',1,0,0,0,0,0,0,0,0,0,0,0,0,0,system shall able display printable summary individual cohort include student enlisted program study sequence class cohort progress program timeline completion
3,'The system shall be able to display a printable summary for individual clinical sites which will include information on labs being held at that site for the given quarter (Clinical site general information on labs held at that location dates and times of all labs held there).',1,0,0,0,0,0,0,0,0,0,0,0,0,0,system shall able display printable summary individual clinical site include information lab held site given quarter clinical site general information lab held location date time lab held
3,'The system shall be able to display a printable summary for individual clinical labs which will include (but not be limited to) class name class number lab section listing of students enrolled instructor day(s) time and location.',1,0,0,0,0,0,0,0,0,0,0,0,0,0,system shall able display printable summary individual clinical lab include limited class name class number lab section listing student enrolled instructor day time location
3,'The system shall be able to display a printable summary for individual nursing students which will include (but not be limited to) student name student ID admission date classes credits GPA and the cohort that the student is enrolled in.',1,0,0,0,0,0,0,0,0,0,0,0,0,0,system shall able display printable summary individual nursing student include limited student name student id admission date class credit gpa cohort student enrolled
3,'The system shall be able to display a printable summary of the system log.',1,0,0,0,0,0,0,0,0,0,0,0,0,0,system shall able display printable summary system log
3,'The system shall contain contact information (e-mail and phone number) for all people relevant to the system including (but not limited to) staff members students lecture instructors clinical lab instructors and clinical site administrators.',1,0,0,0,0,0,0,0,0,0,0,0,0,0,system shall contain contact information email phone number people relevant system including limited staff member student lecture instructor clinical lab instructor clinical site administrator
3,'The system will use the stored e-mail addresses as a primary means of communicating information to affected parties.',1,0,0,0,0,0,0,0,0,0,0,0,0,0,system use stored email address primary mean communicating information affected party
3,'The system will notify affected parties for routine communication purposes including but not limited to informing students of upcoming offered classes (timeline) and what their schedule will be/shall be.',1,0,0,0,0,0,0,0,0,0,0,0,0,0,system notify affected party routine communication purpose including limited informing student upcoming offered class timeline schedule beshall
3,'The system will notify affected parties when changes occur affecting clinicals including but not limited to clinical section capacity changes and clinical section cancellations.',1,0,0,0,0,0,0,0,0,0,0,0,0,0,system notify affected party change occur affecting clinicals including limited clinical section capacity change clinical section cancellation
3,'The system will notify affected parties when changes occur affecting classes including but not limited to class cancellations class section detail changes and changes to class offerings for a given quarter.',1,0,0,0,0,0,0,0,0,0,0,0,0,0,system notify affected party change occur affecting class including limited class cancellation class section detail change change class offering given quarter
3,The system will notify affected parties when changes occur affecting cohorts including but not limited to changes to the sequence for a cohort's program of study and changes to a given week's schedule (lab cancelled this week due to instructor illness).',1,0,0,0,0,0,0,0,0,0,0,0,0,0,system notify affected party change occur affecting cohort including limited change sequence cohort program study change given week schedule lab cancelled week due instructor illness
3,The system will notify affected parties when changes occur affecting specific students including but not limited to changing a student's status from full time to part time and moving a student to a different clinical section.',1,0,0,0,0,0,0,0,0,0,0,0,0,0,system notify affected party change occur affecting specific student including limited changing student status full time part time moving student different clinical section
3,'Program Administrators/Nursing Staff Members shall have the ability to modify information relating to cohorts including cohort identifier program of study preferred sequence of classes and quarters that a cohort will be taking specific classes.',1,0,0,0,0,0,0,0,0,0,0,0,0,0,program administratorsnursing staff member shall ability modify information relating cohort including cohort identifier program study preferred sequence class quarter cohort taking specific class
3,'Program Administrators/Nursing Staff Members shall have the ability to modify information relating to a Program of Study within the Nursing Department including the Program of study name and required classes for that Program of Study.',1,0,0,0,0,0,0,0,0,0,0,0,0,0,program administratorsnursing staff member shall ability modify information relating program study within nursing department including program study name required class program study
3,'Program Administrators/Nursing Staff Members shall have the ability to modify information relating to a Clinical Site including the clinical site name site contact person contact information and address.',1,0,0,0,0,0,0,0,0,0,0,0,0,0,program administratorsnursing staff member shall ability modify information relating clinical site including clinical site name site contact person contact information address
3,'Program Administrators/Nursing Staff Members shall have the ability to modify information relating to a Clinical Lab Section including the clinical site name the department/section for the lab the class instructor day and time of lab and contact information.',1,0,0,0,0,0,0,0,0,0,0,0,0,0,program administratorsnursing staff member shall ability modify information relating clinical lab section including clinical site name departmentsection lab class instructor day time lab contact information
3,'Program Administrators/Nursing Staff Members shall have the ability to modify information relating to a Nursing Student including student ID student name phone number e-mail status (full time or part time) and program of study.',1,0,0,0,0,0,0,0,0,0,0,0,0,0,program administratorsnursing staff member shall ability modify information relating nursing student including student id student name phone number email status full time part time program study
4,'The Disputes application shall comply with the corporate standards for user interface creation for internally and externally used applications.',0,1,0,0,1,1,0,0,0,0,0,0,0,0,dispute application shall comply corporate standard user interface creation internally externally used application
4,'All screens created as part of the Disputes application must comply with corporate standards for interface creation.',0,1,0,0,1,1,0,0,0,0,0,0,0,0,screen created part dispute application must comply corporate standard interface creation
4,'The list of dispute cases that are displayed after a search is performed must be color coded for easy identification of dispute cases based upon the dispute case status.',0,1,0,0,0,1,0,0,0,0,0,0,0,0,list dispute case displayed search performed must color coded easy identification dispute case based upon dispute case status
4,'100% of the cardmember and merchant services representatives shall use the Disputes application regularly after a 2-day training course.',0,1,0,0,0,0,0,0,0,0,1,0,1,0,NUM cardmember merchant service representative shall use dispute application regularly NUM day training course
4,'100% of cardmember services representatives shall be able to successfully create a dispute case on the first encounter after completing the training course.',0,1,0,0,0,0,0,0,0,0,1,0,1,0,NUM cardmember service representative shall able successfully create dispute case first encounter completing training course
4,'100% of merchant services representatives shall be able to successfully perform a follow up action on a dispute case on the first encounter after completing the training course.',0,1,0,0,0,0,0,0,0,0,1,0,1,0,NUM merchant service representative shall able successfully perform follow action dispute case first encounter completing training course
4,'The maximum wait time for a user navigating from one screen to another within the Disputes application shall be no more than 5 seconds.',0,1,0,0,0,0,0,0,1,0,0,0,0,0,maximum wait time user navigating one screen another within dispute application shall NUM second
4,'The Disputes application shall support 350 concurrent users without any degradation of performance in the application.',0,1,0,0,0,0,0,0,1,0,1,0,0,0,dispute application shall support NUM concurrent user without degradation performance application
4,'The Disputes application shall be available 24x7x365 with the exception of the following scheduled maintenance windows. Monday â€“ Saturday 3:00am to 4:00am EST Sunday 1:00amd to 5:00am EST',0,1,1,0,0,0,0,1,0,0,0,0,0,0,dispute application shall available NUM x NUM x NUM exception following scheduled maintenance window monday â saturday NUM am NUM am est sunday NUM amd NUM am est
4,'The Disputes application shall interface with the Statement Database. The Statement Database provides the transaction details to the Disputes System. All transaction details must be obtained from the Statement Database',0,1,0,0,0,0,0,1,0,0,0,0,0,0,dispute application shall interface statement database statement database provides transaction detail dispute system transaction detail must obtained statement database
4,'The Disputes application shall interface with the Cardmember Information Database. The Cardmember Information Database provides detailed information with regard to a cardmember. All cardmember detail information must be obtained from the Cardmember Information Database.',0,1,0,0,0,0,0,1,0,0,0,0,0,0,dispute application shall interface cardmember information database cardmember information database provides detailed information regard cardmember cardmember detail information must obtained cardmember information database
4,'The Disputes applications shall interface with the Merchant Information Database. The Merchant Information Database provides detailed information with regard to the merchant. All merchant detail information shall be obtained from the Merchant Information Database.',0,1,0,0,0,0,0,1,0,0,0,0,0,0,dispute application shall interface merchant information database merchant information database provides detailed information regard merchant merchant detail information shall obtained merchant information database
4,'The Disputes application shall interface with the Letters application. This will allow the Disputes application to request letters as part of the dispute initiation and dispute follow up process. All letter requests must be sent to the Print Letter Utility application.',0,1,0,0,0,0,0,1,0,0,0,0,0,0,dispute application shall interface letter application allow dispute application request letter part dispute initiation dispute follow process letter request must sent print letter utility application
4,The Disputes application shall interface with the Cardmember Posting and Billing System. This will allow the Disputes application to request adjustments to cardmember and merchant's accounts. All adjustment requests must be sent to the Cardmember Posting and Billing System.',0,1,0,0,0,0,0,1,0,0,0,0,0,0,dispute application shall interface cardmember posting billing system allow dispute application request adjustment cardmember merchant account adjustment request must sent cardmember posting billing system
4,'The Disputes application shall ensure that only users with the appropriate access level are allowed to initiate dispute requests.',0,1,0,0,0,0,0,0,0,0,0,1,0,0,dispute application shall ensure user appropriate access level allowed initiate dispute request
4,'Only users with Update access must be able to initiate dispute requests.',1,1,0,0,0,0,0,0,0,0,0,1,0,0,user update access must able initiate dispute request
4,'The Disputes application shall ensure that only authorized users are allowed to logon to the application.',0,1,0,0,0,0,0,0,0,0,0,1,0,0,dispute application shall ensure authorized user allowed logon application
4,'All authorized users once authenticated must be able to logon to the Disputes System',0,1,0,0,0,0,0,0,0,0,0,1,0,0,authorized user authenticated must able logon dispute system
4,The Disputes System shall generate a User Report that details any new users that have been added and any changes to an existing user's access level. The report will be reviewed for auditing purposes.',1,0,0,0,0,0,0,0,0,0,0,0,0,0,dispute system shall generate user report detail new user added change existing user access level report reviewed auditing purpose
4,All additions of new users and modifications to user's access shall be recorded on the User Report.',1,0,0,0,0,0,0,0,0,0,0,0,0,0,addition new user modification user access shall recorded user report
4,'If a user account is revoked it can only be re-instantiated by the System Administrator.',0,1,0,0,0,0,0,0,0,0,0,1,0,0,user account revoked reinstantiated system administrator
4,'Only the System Administrator shall be able to reset a revoked user logon account',0,1,0,0,0,0,0,0,0,0,0,1,0,0,system administrator shall able reset revoked user logon account
4,'The Disputes application shall manipulate and view business data. Users will not have direct access to data files or databases.',1,1,0,0,0,0,0,0,0,0,0,1,0,0,dispute application shall manipulate view business data user direct access data file database
4,'All updates to data files or database must be initiated from the Disputes System.',0,0,0,0,0,0,0,0,0,0,0,0,0,0,update data file database must initiated dispute system
4,'The Disputes application must conform to the legal requirements as specified by the Merchant Operating Regulations.',0,1,0,0,1,0,0,0,0,0,0,0,0,0,dispute application must conform legal requirement specified merchant operating regulation
4,'All business rules specified in the Disputes System shall be in compliance with the Merchant Operating Regulations.',0,1,0,0,1,0,0,0,0,0,0,0,0,0,business rule specified dispute system shall compliance merchant operating regulation
4,'The Disputes application must conform to the legal requirements as specified by Regulation E and Regulation Z that govern credit card disputes processing.',0,1,0,0,1,0,0,0,0,0,0,0,0,0,dispute application must conform legal requirement specified regulation e regulation z govern credit card dispute processing
4,'All business rules specified in the Disputes System shall be in compliance to the guidelines of Regulation E and Regulation Z.',0,1,0,0,1,0,0,0,0,0,0,0,0,0,business rule specified dispute system shall compliance guideline regulation e regulation z
4,'The Disputes application must maintain a detailed history of every action that a user takes on a dispute case. This ensures a complete audit trail if questions arise later on with regard to a particular dispute case.',1,1,0,0,1,0,0,0,0,0,0,0,0,0,dispute application must maintain detailed history every action user take dispute case ensures complete audit trail question arise later regard particular dispute case
4,'All actions that modify an existing dispute case must be recorded in the case history.',1,1,0,0,1,0,1,0,0,0,0,0,0,0,action modify existing dispute case must recorded case history
4,'The Disputes System must be accessible by both internal and external users.',0,1,1,0,0,0,0,0,0,0,0,1,0,0,dispute system must accessible internal external user
4,'The Disputes System must prevent users from accessing any dispute cases that do not belong to their cardholder base.',0,1,0,0,0,0,0,0,0,0,0,1,0,0,dispute system must prevent user accessing dispute case belong cardholder base
4,'The Disputes System will facilitate direct data entry of a dispute case via a user interface that supports real time responses to the users.',0,1,0,0,0,0,0,0,1,0,1,0,0,0,dispute system facilitate direct data entry dispute case via user interface support real time response user
4,'The Disputes System must provide different levels of access with regard to disputes case initiation and follow-up actions.',0,1,0,0,0,0,0,0,0,0,0,1,0,0,dispute system must provide different level access regard dispute case initiation followup action
4,'The Disputes System shall provide view access capability for authorized users of the application.',0,1,0,0,0,0,0,0,0,0,0,1,0,0,dispute system shall provide view access capability authorized user application
4,'The Disputes System shall provide update access capability for authorized users of the application.',1,1,0,0,0,0,0,0,0,0,0,1,0,0,dispute system shall provide update access capability authorized user application
4,'The Disputes System must allow the users to select disputable transactions (based on the age of the transaction) from a user interface and initiate a dispute (ticket retrieval request or chargeback notification) on the selected transaction.',1,0,0,0,0,0,0,0,0,0,0,0,0,0,dispute system must allow user select disputable transaction based age transaction user interface initiate dispute ticket retrieval request chargeback notification selected transaction
4,'The Disputes System must provide the user the ability to initiate a single dispute case on multiple transactions that belong to a single merchant.',1,0,0,0,0,0,0,0,0,0,0,0,0,0,dispute system must provide user ability initiate single dispute case multiple transaction belong single merchant
4,'The Disputes System will provide the user the ability to create or initiate a ticket retrieval request. As part of ticket retrieval creation process the system must prompt the user to enter all the required information to create the ticket retrieval request. The ticket retrieval request is a document that is sent to merchant inquiring the validity of a transaction.',1,0,0,0,0,0,0,0,0,0,0,0,0,0,dispute system provide user ability create initiate ticket retrieval request part ticket retrieval creation process system must prompt user enter required information create ticket retrieval request ticket retrieval request document sent merchant inquiring validity transaction
4,'The Disputes System must allow the user to create three unique types of ticket retrieval requests. The three types of ticket retrieval requests are (1) Request for original receipt (2) Request for a copy of the receipt or (3) Request for a portfolio. A portfolio consists of documentation that would provide proof of a purchase such as the documentation that is received from a car rental agency that is more than a sales receipt.',1,0,0,0,0,0,0,0,0,0,0,0,0,0,dispute system must allow user create three unique type ticket retrieval request three type ticket retrieval request NUM request original receipt NUM request copy receipt NUM request portfolio portfolio consists documentation would provide proof purchase documentation received car rental agency sale receipt
4,'The Disputes System must prevent external users from requesting original receipts. Requests for original receipts are restricted to internal users.',1,0,0,0,0,0,0,0,0,0,0,0,0,0,dispute system must prevent external user requesting original receipt request original receipt restricted internal user
4,'The Disputes System must provide a confirmation to the user upon the creation of ticket retrieval request that contains the following information; the dispute case number the type of retrieval requested (copy original or portfolio) and the date that the merchant response is due.',1,0,0,0,0,0,0,0,0,0,0,0,0,0,dispute system must provide confirmation user upon creation ticket retrieval request contains following information dispute case number type retrieval requested copy original portfolio date merchant response due
4,'The Disputes System shall allow the user to create or initiate a chargeback request. The system must prompt the user to enter the required information to initiate a chargeback request. The chargeback request results in a printed chargeback notification that is sent to merchant indicating that their account will be charged back if no proof is provided that the disputed transaction is valid.',1,0,0,0,0,0,0,0,0,0,0,0,0,0,dispute system shall allow user create initiate chargeback request system must prompt user enter required information initiate chargeback request chargeback request result printed chargeback notification sent merchant indicating account charged back proof provided disputed transaction valid
4,'The Disputes System must provide a confirmation to the user upon the creation of a chargeback request. The confirmation must contain the following information; the dispute case number the type of chargeback requested (pending or immediate) and the date that the merchant response is due.',1,0,0,0,0,0,0,0,0,0,0,0,0,0,dispute system must provide confirmation user upon creation chargeback request confirmation must contain following information dispute case number type chargeback requested pending immediate date merchant response due
4,'The Disputes System shall prevent the creation of duplicate dispute requests 100% of the time.',1,1,0,0,1,0,1,0,0,0,0,0,0,0,dispute system shall prevent creation duplicate dispute request NUM time
4,'The Disputes System shall accurately provide a list of possible reason codes for a given transaction. The list of possible reason codes must be derived based on the type of transaction and the industry that the merchant belongs to according to the business rules defined for the Disputes System.',1,1,0,0,1,0,1,0,0,0,0,0,0,0,dispute system shall accurately provide list possible reason code given transaction list possible reason code must derived based type transaction industry merchant belongs according business rule defined dispute system
4,'The Disputes System must provide the ability to view existing dispute cases.',1,0,0,0,0,0,0,0,0,0,0,0,0,0,dispute system must provide ability view existing dispute case
4,'The Disputes System must provide Search functionality. The search method must include the ability to search by (1) the dispute case number (2) the merchant account number (3) the cardmember account number and (4) the issuer number. In addition to the above criteria the search functionality must further allow the user to limit the results of the search by a date range the type of dispute (ticket retrieval request or chargeback notification) the case status (open closed or all) and the dispute reason code.',1,0,0,0,0,0,0,0,0,0,0,0,0,0,dispute system must provide search functionality search method must include ability search NUM dispute case number NUM merchant account number NUM cardmember account number NUM issuer number addition criterion search functionality must allow user limit result search date range type dispute ticket retrieval request chargeback notification case status open closed dispute reason code
4,'A list of all disputes cases that meet the entered search criteria must be provided to the user. The list of cases must differentiate the type and/or status of the case by color -coding the line item in the list. For example all open cases will be yellow and all closed cases will be gray.',1,1,0,0,0,1,0,0,0,0,0,0,0,0,list dispute case meet entered search criterion must provided user list case must differentiate type andor status case color coding line item list example open case yellow closed case gray
4,'The Disputes System shall provide the users the ability to view the history of all activities that have occurred on the dispute case.',1,0,0,0,0,0,0,0,0,0,0,0,0,0,dispute system shall provide user ability view history activity occurred dispute case
4,'The Dispute System shall provide the users with the ability to follow up on a dispute case via follow-up actions. The list of available follow up actions for a given dispute case must be filtered by the status of the case and the access level of the user.',1,0,0,0,0,0,0,0,0,0,0,0,0,0,dispute system shall provide user ability follow dispute case via followup action list available follow action given dispute case must filtered status case access level user
